,0,1
0,Locally Uniform Comparison Image Descriptor.,"Andrew Ziegler,Eric M. Christiansen,David J. Kriegman,Serge J. Belongie,"
1,Learning from Distributions via Support Measure Machines.,"Krikamol Muandet,Kenji Fukumizu,Francesco Dinuzzo,Bernhard Schölkopf,"
2,Finding Exemplars from Pairwise Dissimilarities via Simultaneous Sparse Recovery.,"Ehsan Elhamifar,Guillermo Sapiro,René Vidal,"
3,Feature Clustering for Accelerating Parallel Coordinate Descent.,"Chad Scherrer,Ambuj Tewari,Mahantesh Halappanavar,David Haglin,"
4,Multi-scale Hyper-time Hardware Emulation of Human Motor Nervous System Based on Spiking Neurons using FPGA.,"Chuanxin Minos Niu,Sirish K. Nandyala,Won Joon Sohn,Terence D. Sanger,"
5,Active Learning of Model Evidence Using Bayesian Quadrature.,"Michael A. Osborne,David Duvenaud,Roman Garnett,Carl E. Rasmussen,Stephen J. Roberts,Zoubin Ghahramani,"
6,Coupling Nonparametric Mixtures via Latent Dirichlet Processes.,"Dahua Lin,John W. Fisher III,"
7,Nonparametric Max-Margin Matrix Factorization for Collaborative Prediction.,"Minjie Xu,Jun Zhu,Bo Zhang,"
8,Bayesian Hierarchical Reinforcement Learning.,"Feng Cao,Soumya Ray,"
9,Dynamic Pruning of Factor Graphs for Maximum Marginal Prediction.,"Christoph H. Lampert,"
10,Local Supervised Learning through Space Partitioning.,"Joseph Wang,Venkatesh Saligrama,"
11,A Generative Model for Parts-based Object Segmentation.,"S. M. Ali Eslami,Christopher K. I. Williams,"
12,Super-Bit Locality-Sensitive Hashing.,"Jianqiu Ji,Jianmin Li,Shuicheng Yan,Bo Zhang,Qi Tian,"
13,The Bethe Partition Function of Log-supermodular Graphical Models.,"Nicholas Ruozzi,"
14,Random Utility Theory for Social Choice.,"Hossein Azari Soufiani,David C. Parkes,Lirong Xia,"
15,Putting Bayes to sleep.,"Wouter M. Koolen,Dmitry Adamskiy,Manfred K. Warmuth,"
16,A new metric on the manifold of kernel matrices with application to matrix geometric means.,"Suvrit Sra,"
17,Mandatory Leaf Node Prediction in Hierarchical Multilabel Classification.,"Wei Bi,James T. Kwok,"
18,Smooth-projected Neighborhood Pursuit for High-dimensional Nonparanormal Graph Estimation.,"Tuo Zhao,Kathryn Roeder,Han Liu,"
19,Semiparametric Principal Component Analysis.,"Fang Han,Han Liu,"
20,Coding efficiency and detectability of rate fluctuations with non-Poisson neuronal firing.,"Shinsuke Koyama,"
21,The representer theorem for Hilbert spaces: a necessary and sufficient condition.,"Francesco Dinuzzo,Bernhard Schölkopf,"
22,"""On the (Non-)existence of Convex, Calibrated Surrogate Losses for Ranking"".","Clément Calauzènes,Nicolas Usunier,Patrick Gallinari,"
23,Exploration in Model-based Reinforcement Learning by Empirically Estimating Learning Progress.,"Manuel Lopes,Tobias Lang,Marc Toussaint,Pierre-Yves Oudeyer,"
24,Supervised Learning with Similarity Functions.,"Purushottam Kar,Prateek Jain,"
25,Cocktail Party Processing via Structured Prediction.,"Yuxuan Wang,DeLiang Wang,"
26,Robustness and risk-sensitivity in Markov decision processes.,"Takayuki Osogami,"
27,Dynamical And-Or Graph Learning for Object Shape Modeling and Detection.,"Xiaolong Wang,Liang Lin,"
28,Adaptive Stratified Sampling for Monte-Carlo integration of Differentiable functions.,"Alexandra Carpentier,Rémi Munos,"
29,Distributed Non-Stochastic Experts.,"Varun Kanade,Zhenming Liu,Bozidar Radunovic,"
30,An Integer Optimization Approach to Associative Classification.,"Allison Chang,Dimitris Bertsimas,Cynthia Rudin,"
31,Learning Image Descriptors with the Boosting-Trick.,"Tomasz Trzcinski,C. Mario Christoudias,Vincent Lepetit,Pascal Fua,"
32,Fast Resampling Weighted v-Statistics.,"Chunxiao Zhou,Jiseong Park,Yun Fu,"
33,Multi-task Vector Field Learning.,"Binbin Lin,Sen Yang,Chiyuan Zhang,Jieping Ye,Xiaofei He,"
34,Memorability of Image Regions.,"Aditya Khosla,Jianxiong Xiao,Antonio Torralba,Aude Oliva,"
35,Nonparametric Bayesian Inverse Reinforcement Learning for Multiple Reward Functions.,"Jaedeug Choi,Kee-Eung Kim,"
36,Automatic Feature Induction for Stagewise Collaborative Filtering.,"Joonseok Lee,Mingxuan Sun,Seungyeon Kim,Guy Lebanon,"
37,Selective Labeling via Error Bound Minimization.,"Quanquan Gu,Tong Zhang,Chris H. Q. Ding,Jiawei Han,"
38,Volume Regularization for Binary Classification.,"Koby Crammer,Tal Wagner,"
39,Image Denoising and Inpainting with Deep Neural Networks.,"Junyuan Xie,Linli Xu,Enhong Chen,"
40,Max-Margin Structured Output Regression for Spatio-Temporal Action Localization.,"Du Tran,Junsong Yuan,"
41,Transelliptical Component Analysis.,"Fang Han,Han Liu,"
42,Action-Model Based Multi-agent Plan Recognition.,"Hankz Hankui Zhuo,Qiang Yang,Subbarao Kambhampati,"
43,Visual Recognition using Embedded Feature Selection for Curvature Self-Similarity.,"Angela Eigenstetter,Björn Ommer,"
44,Non-parametric Approximate Dynamic Programming via the Kernel Method.,"Nikhil Bhat,Ciamac C. Moallemi,Vivek F. Farias,"
45,Optimal Regularized Dual Averaging Methods for Stochastic Optimization.,"Xi Chen,Qihang Lin,Javier Peña,"
46,The variational hierarchical EM algorithm for clustering hidden Markov models.,"Emanuele Coviello,Antoni B. Chan,Gert R. G. Lanckriet,"
47,Truncation-free Online Variational Inference for Bayesian Nonparametric Models.,"Chong Wang,David M. Blei,"
48,3D Social Saliency from Head-mounted Cameras.,"Hyun Soo Park,Eakta Jain,Yaser Sheikh,"
49,Context-Sensitive Decision Forests for Object Detection.,"Peter Kontschieder,Samuel Rota Bulò,Antonio Criminisi,Pushmeet Kohli,Marcello Pelillo,Horst Bischof,"
50,Learning Invariant Representations of Molecules for Atomization Energy Prediction.,"Grégoire Montavon,Katja Hansen,Siamac Fazli,Matthias Rupp,Franziska Biegler,Andreas Ziehe,Alexandre Tkatchenko,Anatole von Lilienfeld,Klaus-Robert Müller,"
51,Bandit Algorithms boost Brain Computer Interfaces for motor-task selection of a brain-controlled button.,"Joan Fruitet,Alexandra Carpentier,Rémi Munos,Maureen Clerc,"
52,Multiplicative Forests for Continuous-Time Processes.,"Jeremy C. Weiss,Sriraam Natarajan,David Page,"
53,Patient Risk Stratification for Hospital-Associated C. diff as a Time-Series Classification Task.,"Jenna Wiens,John V. Guttag,Eric Horvitz,"
54,Nyström Method vs Random Fourier Features: A Theoretical and Empirical Comparison.,"Tianbao Yang,Yu-Feng Li,Mehrdad Mahdavi,Rong Jin,Zhi-Hua Zhou,"
55,Multiclass Learning Approaches: A Theoretical Comparison with Implications.,"Amit Daniely,Sivan Sabato,Shai Shalev-Shwartz,"
56,Stochastic Gradient Descent with Only One Projection.,"Mehrdad Mahdavi,Tianbao Yang,Rong Jin,Shenghuo Zhu,Jinfeng Yi,"
57,"""Neuronal spike generation mechanism as an oversampling, noise-shaping A-to-D converter"".","Dmitri B. Chklovskii,Daniel Soudry,"
58,Deep Spatio-Temporal Architectures and Learning for Protein Structure Prediction.,"Pietro Di Lena,Pierre Baldi,Ken Nagata,"
59,Assessing Blinding in Clinical Trials.,"Ognjen Arandjelovic,"
60,Scalable nonconvex inexact proximal splitting.,"Suvrit Sra,"
61,Learning to Discover Social Circles in Ego Networks.,"Julian J. McAuley,Jure Leskovec,"
62,A Conditional Multinomial Mixture Model for Superset Label Learning.,"Li-Ping Liu,Thomas G. Dietterich,"
63,Majorization for CRFs and Latent Likelihoods.,"Tony Jebara,Anna Choromanska,"
64,Ensemble weighted kernel estimators for multivariate entropy estimation.,"Kumar Sricharan,Alfred O. Hero III,"
65,Efficient high dimensional maximum entropy modeling via symmetric partition functions.,"Paul Vernaza,Drew Bagnell,"
66,Discriminatively Trained Sparse Code Gradients for Contour Detection.,"Xiaofeng Ren,Liefeng Bo,"
67,Analyzing 3D Objects in Cluttered Images.,"Mohsen Hejrati,Deva Ramanan,"
68,Nonconvex Penalization Using Laplace Exponents and Concave Conjugates.,"Zhihua Zhang,Bojun Tu,"
69,3D Object Detection and Viewpoint Estimation with a Deformable 3D Cuboid Model.,"Sanja Fidler,Sven J. Dickinson,Raquel Urtasun,"
70,Structured Learning of Gaussian Graphical Models.,"Karthik Mohan,Michael Jae-Yoon Chung,Seungyeop Han,Daniela M. Witten,Su-In Lee,Maryam Fazel,"
71,A Polylog Pivot Steps Simplex Algorithm for Classification.,"Elad Hazan,Zohar Shay Karnin,"
72,Shifting Weights: Adapting Object Detectors from Image to Video.,"Kevin D. Tang,Vignesh Ramanathan,Fei-Fei Li,Daphne Koller,"
73,A Scalable CUR Matrix Decomposition Algorithm: Lower Time Complexity and Tighter Bound.,"Shusen Wang,Zhihua Zhang,"
74,Convolutional-Recursive Deep Learning for 3D Object Classification.,"Richard Socher,Brody Huval,Bharath Putta Bath,Christopher D. Manning,Andrew Y. Ng,"
75,Semi-Supervised Domain Adaptation with Non-Parametric Copulas.,"David López-Paz,José Miguel Hernández-Lobato,Bernhard Schölkopf,"
76,Identification of Recurrent Patterns in the Activation of Brain Networks.,"Firdaus Janoos,Weichang Li,Niranjan A. Subrahmanya,István Ákos Mórocz,William M. Wells III,"
77,Density-Difference Estimation.,"Masashi Sugiyama,Takafumi Kanamori,Taiji Suzuki,Marthinus Christoffel du Plessis,Song Liu,Ichiro Takeuchi,"
78,Variational Inference for Crowdsourcing.,"Qiang Liu,Jian Peng,Alexander T. Ihler,"
79,MCMC for continuous-time discrete-state systems.,"Vinayak A. Rao,Yee Whye Teh,"
80,A P300 BCI for the Masses: Prior Information Enables Instant Unsupervised Spelling.,"Pieter-Jan Kindermans,Hannes Verschore,David Verstraeten,Benjamin Schrauwen,"
81,Learning about Canonical Views from Internet Image Collections.,"Elad Mezuman,Yair Weiss,"
82,Learning High-Density Regions for a Generalized Kolmogorov-Smirnov Test in High-Dimensional Data.,"Assaf Glazer,Michael Lindenbaum,Shaul Markovitch,"
83,Multiresolution Gaussian Processes.,"Emily B. Fox,David B. Dunson,"
84,Localizing 3D cuboids in single-view images.,"Jianxiong Xiao,Bryan C. Russell,Antonio Torralba,"
85,Newton-Like Methods for Sparse Inverse Covariance Estimation.,"Peder A. Olsen,Figen Öztoprak,Jorge Nocedal,Steven J. Rennie,"
86,Learning to Align from Scratch.,"Gary B. Huang,Marwan A. Mattar,Honglak Lee,Erik G. Learned-Miller,"
87,Homeostatic plasticity in Bayesian spiking networks as Expectation Maximization with posterior constraints.,"Stefan Habenschuss,Johannes Bill,Bernhard Nessler,"
88,Clustering Aggregation as Maximum-Weight Independent Set.,"Nan Li,Longin Jan Latecki,"
89,Topology Constraints in Graphical Models.,"Marcelo Fiori,Pablo Musé,Guillermo Sapiro,"
90,Transelliptical Graphical Models.,"Han Liu,Fang Han,Cun-Hui Zhang,"
91,Kernel Latent SVM for Visual Recognition.,"Weilong Yang,Yang Wang,Arash Vahdat,Greg Mori,"
92,Learning Partially Observable Models Using Temporally Abstract Decision Trees.,"Erik Talvitie,"
93,Proximal Newton-type methods for convex optimization.,"Jason D. Lee,Yuekai Sun,Michael A. Saunders,"
94,Regularized Off-Policy TD-Learning.,"Bo Liu,Sridhar Mahadevan,Ji Liu,"
95,Multi-criteria Anomaly Detection using Pareto Depth Analysis.,"Ko-Jen Hsiao,Kevin S. Xu,Jeff Calder,Alfred O. Hero III,"
96,Synchronization can Control Regularization in Neural Systems via Correlated Noise Processes.,"Jake V. Bouvrie,Jean-Jacques E. Slotine,"
97,Calibrated Elastic Regularization in Matrix Completion.,"Tingni Sun,Cun-Hui Zhang,"
98,Predicting Action Content On-Line and in Real Time before Action Onset - an Intracranial Human Study.,"Uri Maoz,Shengxuan Ye,Ian B. Ross,Adam N. Mamelak,Christof Koch,"
99,Searching for objects driven by context.,"Bogdan Alexe,Nicolas Heess,Yee Whye Teh,Vittorio Ferrari,"
100,Timely Object Recognition.,"Sergey Karayev,Tobias Baumgartner,Mario Fritz,Trevor Darrell,"
101,Nonparanormal Belief Propagation (NPNBP).,"Gal Elidan,Cobi Cario,"
102,Deep Representations and Codes for Image Auto-Annotation.,"Ryan Kiros,Csaba Szepesvári,"
103,A Spectral Algorithm for Latent Dirichlet Allocation.,"Anima Anandkumar,Dean P. Foster,Daniel J. Hsu,Sham M. Kakade,Yi-Kai Liu,"
104,Learning Halfspaces with the Zero-One Loss: Time-Accuracy Tradeoffs.,"Aharon Birnbaum,Shai Shalev-Shwartz,"
105,Matrix reconstruction with the local max norm.,"Rina Foygel,Nathan Srebro,Ruslan Salakhutdinov,"
106,Analog readout for optical reservoir computers.,"Anteo Smerieri,François Duport,Yvan Paquot,Benjamin Schrauwen,Marc Haelterman,Serge Massar,"
107,Accuracy at the Top.,"Stephen P. Boyd,Corinna Cortes,Mehryar Mohri,Ana Radovanovic,"
108,Minimizing Sparse High-Order Energies by Submodular Vertex-Cover.,"Andrew Delong,Olga Veksler,Anton Osokin,Yuri Boykov,"
109,Perfect Dimensionality Recovery by Variational Bayesian PCA.,"Shinichi Nakajima,Ryota Tomioka,Masashi Sugiyama,S. Derin Babacan,"
110,Mirror Descent Meets Fixed Share (and feels no regret).,"Nicolò Cesa-Bianchi,Pierre Gaillard,Gábor Lugosi,Gilles Stoltz,"
111,Near-optimal Differentially Private Principal Components.,"Kamalika Chaudhuri,Anand D. Sarwate,Kaushik Sinha,"
112,Random function priors for exchangeable arrays with applications to graphs and relational data.,"James Robert Lloyd,Peter Orbanz,Zoubin Ghahramani,Daniel M. Roy,"
113,Inverse Reinforcement Learning through Structured Classification.,"Edouard Klein,Matthieu Geist,Bilal Piot,Olivier Pietquin,"
114,Augmented-SVM: Automatic space partitioning for combining multiple non-linear dynamics.,"Ashwini Shukla,Aude Billard,"
115,Efficient Bayes-Adaptive Reinforcement Learning using Sample-Based Search.,"Arthur Guez,David Silver,Peter Dayan,"
116,Dimensionality Dependent PAC-Bayes Margin Bound.,"Chi Jin,Liwei Wang,"
117,Latent Graphical Model Selection: Efficient Methods for Locally Tree-like Graphs.,"Animashree Anandkumar,Ragupathyraj Valluvan,"
118,Learning Mixtures of Tree Graphical Models.,"Animashree Anandkumar,Daniel J. Hsu,Furong Huang,Sham M. Kakade,"
119,Hamming Distance Metric Learning.,"Mohammad Norouzi,David J. Fleet,Ruslan Salakhutdinov,"
120,Spiking and saturating dendrites differentially expand single neuron computation capacity.,"Romain Daniel Cazé,Mark D. Humphries,Boris S. Gutkin,"
121,Clustering by Nonnegative Matrix Factorization Using Graph Random Walk.,"Zhirong Yang,Tele Hao,Onur Dikmen,Xi Chen,Erkki Oja,"
122,Delay Compensation with Dynamical Synapses.,"C. C. Alan Fung,K. Y. Michael Wong,Si Wu,"
123,A dynamic excitatory-inhibitory network in a VLSI chip for spiking information reregistration.,"Juan Huo,"
124,ImageNet Classification with Deep Convolutional Neural Networks.,"Alex Krizhevsky,Ilya Sutskever,Geoffrey E. Hinton,"
125,Recognizing Activities by Attribute Dynamics.,"Weixin Li,Nuno Vasconcelos,"
126,Compressive Sensing MRI with Wavelet Tree Sparsity.,"Chen Chen,Junzhou Huang,"
127,Training sparse natural image models with a fast Gibbs sampler of an extended state space.,"Lucas Theis,Jascha Sohl-Dickstein,Matthias Bethge,"
128,A Bayesian Approach for Policy Learning from Trajectory Preference Queries.,"Aaron Wilson,Alan Fern,Prasad Tadepalli,"
129,GenDeR: A Generic Diversified Ranking Algorithm.,"Jingrui He,Hanghang Tong,Qiaozhu Mei,Boleslaw K. Szymanski,"
130,On Multilabel Classification and Ranking with Partial Feedback.,"Claudio Gentile,Francesco Orabona,"
131,"""The Lovasz $\theta$ function, SVMs and finding large dense subgraphs"".","Vinay Jethava,Anders Martinsson,Chiranjib Bhattacharyya,Devdatt P. Dubhashi,"
132,Multi-Task Averaging.,"Sergey Feldman,Maya R. Gupta,Bela A. Frigyik,"
133,Unsupervised Structure Discovery for Semantic Analysis of Audio.,"Sourish Chaudhuri,Bhiksha Raj,"
134,A Marginalized Particle Gaussian Process Regression.,"Yali Wang,Brahim Chaib-draa,"
135,Angular Quantization-based Binary Codes for Fast Similarity Search.,"Yunchao Gong,Sanjiv Kumar,Vishal Verma,Svetlana Lazebnik,"
136,Optimal kernel choice for large-scale two-sample tests.,"Arthur Gretton,Bharath K. Sriperumbudur,Dino Sejdinovic,Heiko Strathmann,Sivaraman Balakrishnan,Massimiliano Pontil,Kenji Fukumizu,"
137,Factoring nonnegative matrices with linear programs.,"Ben Recht,Christopher Ré,Joel A. Tropp,Victor Bittorf,"
138,Large Scale Distributed Deep Networks.,"Jeffrey Dean,Greg Corrado,Rajat Monga,Kai Chen,Matthieu Devin,Quoc V. Le,Mark Z. Mao,Marc'Aurelio Ranzato,Andrew W. Senior,Paul A. Tucker,Ke Yang,Andrew Y. Ng,"
139,Statistical Consistency of Ranking Methods in A Rank-Differentiable Probability Space.,"Yanyan Lan,Jiafeng Guo,Xueqi Cheng,Tie-Yan Liu,"
140,Wavelet based multi-scale shape features on arbitrary surfaces for cortical thickness discrimination.,"Won Hwa Kim,Deepti Pachauri,Charles Hatt,Moo K. Chung,Sterling C. Johnson,Vikas Singh,"
141,A Convex Formulation for Learning Scale-Free Networks via Submodular Relaxation.,"Aaron Defazio,Tibério S. Caetano,"
142,Fused sparsity and robust estimation for linear models with unknown variance.,"Arnak S. Dalalyan,Yin Chen,"
143,How Prior Probability Influences Decision Making: A Unifying Probabilistic Model.,"Yanping Huang,Abram L. Friesen,Timothy D. Hanks,Michael N. Shadlen,Rajesh P. N. Rao,"
144,High-Order Multi-Task Feature Learning to Identify Longitudinal Phenotypic Markers for Alzheimer's Disease Progression Prediction.,"Hua Wang,Feiping Nie,Heng Huang,Jingwen Yan,Sungeun Kim,Shannon L. Risacher,Andrew J. Saykin,Li Shen,"
145,Symmetric Correspondence Topic Models for Multilingual Text Analysis.,"Kosuke Fukumasu,Koji Eguchi,Eric P. Xing,"
146,Effective Split-Merge Monte Carlo Methods for Nonparametric Models of Sequential Data.,"Michael C. Hughes,Emily B. Fox,Erik B. Sudderth,"
147,Efficient coding provides a direct link between prior and likelihood in perceptual Bayesian inference.,"Xue-Xin Wei,Alan A. Stocker,"
148,Efficient Sampling for Bipartite Matching Problems.,"Maksims Volkovs,Richard S. Zemel,"
149,Learning visual motion in recurrent neural networks.,"Marius Pachitariu,Maneesh Sahani,"
150,Learned Prioritization for Trading Off Accuracy and Speed.,"Jiarong Jiang,Adam R. Teichert,Hal Daumé III,Jason Eisner,"
151,Value Pursuit Iteration.,"Amir Massoud Farahmand,Doina Precup,"
152,"""Compressive neural representation of sparse, high-dimensional probabilities"".","Xaq Pitkow,"
153,Graphical Models via Generalized Linear Models.,"Eunho Yang,Pradeep Ravikumar,Genevera I. Allen,Zhandong Liu,"
154,CPRL -- An Extension of Compressive Sensing to the Phase Retrieval Problem.,"Henrik Ohlsson,Allen Y. Yang,Roy Dong,S. Shankar Sastry,"
155,Co-Regularized Hashing for Multimodal Data.,"Yi Zhen,Dit-Yan Yeung,"
156,Convergence and Energy Landscape for Cheeger Cut Clustering.,"Xavier Bresson,Thomas Laurent,David Uminsky,James H. von Brecht,"
157,Symbolic Dynamic Programming for Continuous State and Observation POMDPs.,"Zahra Zamani,Scott Sanner,Pascal Poupart,Kristian Kersting,"
158,Bayesian Probabilistic Co-Subspace Addition.,"Lei Shi,"
159,Scaled Gradients on Grassmann Manifolds for Matrix Completion.,"Thanh T. Ngo,Yousef Saad,"
160,Q-MKL: Matrix-induced Regularization in Multi-Kernel Learning with Applications to Neuroimaging.,"Chris Hinrichs,Vikas Singh,Jiming Peng,Sterling C. Johnson,"
161,Privacy Aware Learning.,"John C. Duchi,Michael I. Jordan,Martin J. Wainwright,"
162,Finite Sample Convergence Rates of Zero-Order Stochastic Optimization Methods.,"John C. Duchi,Michael I. Jordan,Martin J. Wainwright,Andre Wibisono,"
163,Hierarchical Optimistic Region Selection driven by Curiosity.,"Odalric-Ambrym Maillard,"
164,Sparse Prediction with the $k$-Support Norm.,"Andreas Argyriou,Rina Foygel,Nathan Srebro,"
165,Active Learning of Multi-Index Function Models.,"Hemant Tyagi,Volkan Cevher,"
166,Learning Multiple Tasks using Shared Hypotheses.,"Koby Crammer,Yishay Mansour,"
167,On-line Reinforcement Learning Using Incremental Kernel-Based Stochastic Factorization.,"André da Motta Salles Barreto,Doina Precup,Joelle Pineau,"
168,Forward-Backward Activation Algorithm for Hierarchical Hidden Markov Models.,"Kei Wakabayashi,Takao Miura,"
169,Communication-Efficient Algorithms for Statistical Optimization.,"Yuchen Zhang,John C. Duchi,Martin J. Wainwright,"
170,Identifiability and Unmixing of Latent Parse Trees.,"Daniel J. Hsu,Sham M. Kakade,Percy Liang,"
171,Bayesian nonparametric models for ranked data.,"Francois Caron,Yee Whye Teh,"
172,Feature-aware Label Space Dimension Reduction for Multi-label Classification.,"Yao-Nan Chen,Hsuan-Tien Lin,"
173,Stochastic optimization and sparse statistical recovery: Optimal algorithms for high dimensions.,"Alekh Agarwal,Sahand N. Negahban,Martin J. Wainwright,"
174,Graphical Gaussian Vector for Image Categorization.,"Tatsuya Harada,Yasuo Kuniyoshi,"
175,Joint Modeling of a Matrix with Associated Text via Latent Binary Features.,"XianXing Zhang,Lawrence Carin,"
176,Proper losses for learning from partial labels.,"Jesús Cid-Sueiro,"
177,Iterative Thresholding Algorithm for Sparse Inverse Covariance Estimation.,"Benjamin T. Rolfs,Bala Rajaratnam,Dominique Guillot,Ian Wong,Arian Maleki,"
178,Selecting Diverse Features via Spectral Regularization.,"Abhimanyu Das,Anirban Dasgupta,Ravi Kumar,"
179,Monte Carlo Methods for Maximum Margin Supervised Topic Models.,"Qixia Jiang,Jun Zhu,Maosong Sun,Eric P. Xing,"
180,Parametric Local Metric Learning for Nearest Neighbor Classification.,"Jun Wang,Alexandros Kalousis,Adam Woznica,"
181,A Linear Time Active Learning Algorithm for Link Classification.,"Nicolò Cesa-Bianchi,Claudio Gentile,Fabio Vitale,Giovanni Zappella,"
182,Bayesian Warped Gaussian Processes.,"Miguel Lázaro-Gredilla,"
183,Nonparametric Reduced Rank Regression.,"Rina Foygel,Michael Horrell,Mathias Drton,John D. Lafferty,"
184,Multiresolution analysis on the symmetric group.,"Risi Kondor,Walter Dempsey,"
185,Isotropic Hashing.,"Weihao Kong,Wu-Jun Li,"
186,On Lifting the Gibbs Sampling Algorithm.,"Deepak Venugopal,Vibhav Gogate,"
187,On the connections between saliency and tracking.,"Vijay Mahadevan,Nuno Vasconcelos,"
188,Convex Multi-view Subspace Learning.,"Martha White,Yaoliang Yu,Xinhua Zhang,Dale Schuurmans,"
189,Spectral learning of linear dynamics from generalised-linear observations with application to neural population data.,"Lars Buesing,Jakob H. Macke,Maneesh Sahani,"
190,Mixability in Statistical Learning.,"Tim van Erven,Peter D. Grünwald,Mark D. Reid,Robert C. Williamson,"
191,Waveform Driven Plasticity in BiFeO3 Memristive Devices: Model and Implementation.,"Christian Mayr,Paul Stärke,Johannes Partzsch,René Schüffny,Love Cederstroem,Yao Shuai,Nan Du,Heidemarie Schmidt,"
192,A lattice filter model of the visual pathway.,"Karol Gregor,Dmitri B. Chklovskii,"
193,Semantic Kernel Forests from Multiple Taxonomies.,"Sung Ju Hwang,Kristen Grauman,Fei Sha,"
194,Causal discovery with scale-mixture model for spatiotemporal variance dependencies.,"Zhitang Chen,Kun Zhang,Laiwan Chan,"
195,"""Natural Images, Gaussian Mixtures and Dead Leaves"".","Daniel Zoran,Yair Weiss,"
196,Dual-Space Analysis of the Sparse Linear Model.,"David P. Wipf,Yi Wu,"
197,Active Comparison of Prediction Models.,"Christoph Sawade,Niels Landwehr,Tobias Scheffer,"
198,Online Regret Bounds for Undiscounted Continuous Reinforcement Learning.,"Ronald Ortner,Daniil Ryabko,"
199,Generalization Bounds for Domain Adaptation.,"Chao Zhang,Lei Zhang,Jieping Ye,"
200,Semi-Crowdsourced Clustering: Generalizing Crowd Labeling by Robust Distance Metric Learning.,"Jinfeng Yi,Rong Jin,Anil K. Jain,Shaili Jain,Tianbao Yang,"
201,Learning curves for multi-task Gaussian process regression.,"Peter Sollich,Simon R. F. Ashton,"
202,Kernel Hyperalignment.,"Alexander Lorbert,Peter J. Ramadge,"
203,Multiple Choice Learning: Learning to Produce Multiple Structured Outputs.,"Abner Guzmán-Rivera,Dhruv Batra,Pushmeet Kohli,"
204,Mixing Properties of Conditional Markov Chains with Unbounded Feature Functions.,"Mathieu Sinn,Bei Chen,"
205,Persistent Homology for Learning Densities with Bounded Support.,"Florian T. Pokorny,Carl Henrik Ek,Hedvig Kjellström,Danica Kragic,"
206,On the Use of Non-Stationary Policies for Stationary Infinite-Horizon Markov Decision Processes.,"Bruno Scherrer,Boris Lesner,"
207,Efficient Spike-Coding with Multiplicative Adaptation in a Spike Response Model.,"Sander M. Bohte,"
208,MAP Inference in Chains using Column Generation.,"David Belanger,Alexandre Passos,Sebastian Riedel,Andrew McCallum,"
209,Bayesian Nonparametric Modeling of Suicide Attempts.,"Francisco J. R. Ruiz,Isabel Valera,Carlos Blanco,Fernando Pérez-Cruz,"
210,Fiedler Random Fields: A Large-Scale Spectral Approach to Statistical Network Modeling.,"Antonino Freno,Mikaela Keller,Marc Tommasi,"
211,Neurally Plausible Reinforcement Learning of Working Memory Tasks.,"Jaldert O. Rombouts,Sander M. Bohte,Pieter R. Roelfsema,"
212,Efficient Monte Carlo Counterfactual Regret Minimization in Games with Many Player Actions.,"Richard G. Gibson,Neil Burch,Marc Lanctot,Duane Szafron,"
213,Repulsive Mixtures.,"Francesca Petralia,Vinayak A. Rao,David B. Dunson,"
214,Fully Bayesian inference for neural models with negative-binomial spiking.,"Jonathan W. Pillow,James G. Scott,"
215,Slice Normalized Dynamic Markov Logic Networks.,"Tivadar Papai,Henry A. Kautz,Daniel Stefankovic,"
216,Meta-Gaussian Information Bottleneck.,"Mélanie Rey,Volker Roth,"
217,Diffusion Decision Making for Adaptive k-Nearest Neighbor Classification.,"Yung-Kyun Noh,Frank Chongwoo Park,Daniel D. Lee,"
218,The Perturbed Variation.,"Maayan Harel,Shie Mannor,"
219,Communication/Computation Tradeoffs in Consensus-Based Distributed Optimization.,"Konstantinos I. Tsianos,Sean F. Lawlor,Michael G. Rabbat,"
220,The Coloured Noise Expansion and Parameter Estimation of Diffusion Processes.,"Simon M. J. Lyons,Amos J. Storkey,Simo Särkkä,"
221,Online allocation and homogeneous partitioning for piecewise constant mean-approximation.,"Alexandra Carpentier,Odalric-Ambrym Maillard,"
222,Learning as MAP Inference in Discrete Graphical Models.,"Xianghang Liu,James Petterson,Tibério S. Caetano,"
223,A mechanistic model of early sensory processing based on subtracting sparse representations.,"Shaul Druckmann,Tao Hu,Dmitri B. Chklovskii,"
224,Multi-Stage Multi-Task Feature Learning.,"Pinghua Gong,Jieping Ye,Changshui Zhang,"
225,From Deformations to Parts: Motion-based Segmentation of 3D Objects.,"Soumya Ghosh,Erik B. Sudderth,Matthew Loper,Michael J. Black,"
