,0,1
0,Efficient Algorithms for Non-convex Isotonic Regression through Submodular Optimization.,"Francis R. Bach,"
1,Structure-Aware Convolutional Neural Networks.,"Jianlong Chang,Jie Gu,Lingfeng Wang,Gaofeng Meng,Shiming Xiang,Chunhong Pan,"
2,Kalman Normalization: Normalizing Internal Representations Across Network Layers.,"Guangrun Wang,Jiefeng Peng,Ping Luo,Xinjiang Wang,Liang Lin,"
3,HOGWILD!-Gibbs can be PanAccurate.,"Constantinos Daskalakis,Nishanth Dikkala,Siddhartha Jayanti,"
4,Text-Adaptive Generative Adversarial Networks: Manipulating Images with Natural Language.,"Seonghyeon Nam,Yunji Kim,Seon Joo Kim,"
5,IntroVAE: Introspective Variational Autoencoders for Photographic Image Synthesis.,"Huaibo Huang,Zhihang Li,Ran He,Zhenan Sun,Tieniu Tan,"
6,Doubly Robust Bayesian Inference for Non-Stationary Streaming Data with \beta-Divergences.,"Jeremias Knoblauch,Jack Jewson,Theodoros Damoulas,"
7,Adapted Deep Embeddings: A Synthesis of Methods for k-Shot Inductive Transfer Learning.,"Tyler R. Scott,Karl Ridgeway,Michael C. Mozer,"
8,Generalized Inverse Optimization through Online Learning.,"Chaosheng Dong,Yiran Chen,Bo Zeng,"
9,An Off-policy Policy Gradient Theorem Using Emphatic Weightings.,"Ehsan Imani,Eric Graves,Martha White,"
10,Supervised autoencoders: Improving generalization performance with unsupervised regularizers.,"Lei Le,Andrew Patterson,Martha White,"
11,Visual Object Networks: Image Generation with Disentangled 3D Representations.,"Jun-Yan Zhu,Zhoutong Zhang,Chengkai Zhang,Jiajun Wu,Antonio Torralba,Josh Tenenbaum,Bill Freeman,"
12,Understanding Weight Normalized Deep Neural Networks with Rectified Linear Units.,"Yixi Xu,Xiao Wang,"
13,Learning Pipelines with Limited Data and Domain Knowledge: A Study in Parsing Physics Problems.,"Mrinmaya Sachan,Kumar Avinava Dubey,Tom M. Mitchell,Dan Roth,Eric P. Xing,"
14,Learning long-range spatial dependencies with horizontal gated recurrent units.,"Drew Linsley,Junkyung Kim,Vijay Veerabadran,Charles Windolf,Thomas Serre,"
15,Joint Sub-bands Learning with Clique Structures for Wavelet Domain Super-Resolution.,"Zhisheng Zhong,Tiancheng Shen,Yibo Yang,Zhouchen Lin,Chao Zhang,"
16,Fast Similarity Search via Optimal Sparse Lifting.,"Wenye Li,Jingwei Mao,Yin Zhang,Shuguang Cui,"
17,Learning Deep Disentangled Embeddings With the F-Statistic Loss.,"Karl Ridgeway,Michael C. Mozer,"
18,Geometrically Coupled Monte Carlo Sampling.,"Mark Rowland,Krzysztof Choromanski,François Chalus,Aldo Pacchiano,Tamás Sarlós,Richard E. Turner,Adrian Weller,"
19,"Cooperative Holistic Scene Understanding: Unifying 3D Object, Layout, and Camera Pose Estimation.","Siyuan Huang,Siyuan Qi,Yinxue Xiao,Yixin Zhu,Ying Nian Wu,Song-Chun Zhu,"
20,An Efficient Pruning Algorithm for Robust Isotonic Regression.,"Cong Han Lim,"
21,PAC-learning in the presence of adversaries.,"Daniel Cullina,Arjun Nitin Bhagoji,Prateek Mittal,"
22,Sparse DNNs with Improved Adversarial Robustness.,"Yiwen Guo,Chao Zhang,Changshui Zhang,Yurong Chen,"
23,Snap ML: A Hierarchical Framework for Machine Learning.,"Celestine Dünner,Thomas P. Parnell,Dimitrios Sarigiannis,Nikolas Ioannou,Andreea Anghel,Gummadi Ravi,Madhusudanan Kandasamy,Haralampos Pozidis,"
24,See and Think: Disentangling Semantic Scene Completion.,"Shice Liu,Yu Hu,Yiming Zeng,Qiankun Tang,Beibei Jin,Yinhe Han,Xiaowei Li,"
25,Chain of Reasoning for Visual Question Answering.,"Chenfei Wu,Jinlai Liu,Xiaojie Wang,Xuan Dong,"
26,Sigsoftmax: Reanalysis of the Softmax Bottleneck.,"Sekitoshi Kanai,Yasuhiro Fujiwara,Yuki Yamanaka,Shuichi Adachi,"
27,Deep Non-Blind Deconvolution via Generalized Low-Rank Approximation.,"Wenqi Ren,Jiawei Zhang,Lin Ma,Jinshan Pan,Xiaochun Cao,Wangmeng Zuo,Wei Liu,Ming-Hsuan Yang,"
28,Bayesian Pose Graph Optimization via Bingham Distributions and Tempered Geodesic MCMC.,"Tolga Birdal,Umut Simsekli,Mustafa Onur Eken,Slobodan Ilic,"
29,MetaAnchor: Learning to Detect Objects with Customized Anchors.,"Tong Yang,Xiangyu Zhang,Zeming Li,Wenqiang Zhang,Jian Sun,"
30,Image Inpainting via Generative Multi-column Convolutional Neural Networks.,"Yi Wang,Xin Tao,Xiaojuan Qi,Xiaoyong Shen,Jiaya Jia,"
31,On Misinformation Containment in Online Social Networks.,"Guangmo Amo Tong,Ding-Zhu Du,Weili Wu,"
32,A^2-Nets: Double Attention Networks.,"Yunpeng Chen,Yannis Kalantidis,Jianshu Li,Shuicheng Yan,Jiashi Feng,"
33,Self-Supervised Generation of Spatial Audio for 360° Video.,"Pedro Morgado,Nuno Vasconcelos,Timothy R. Langlois,Oliver Wang,"
34,How Many Samples are Needed to Estimate a Convolutional Neural Network?,"Simon S. Du,Yining Wang,Xiyu Zhai,Sivaraman Balakrishnan,Ruslan Salakhutdinov,Aarti Singh,"
35,Algorithmic Regularization in Learning Deep Homogeneous Models: Layers are Automatically Balanced.,"Simon S. Du,Wei Hu,Jason D. Lee,"
36,Optimization for Approximate Submodularity.,"Yaron Singer,Avinatan Hassidim,"
37,(Probably) Concave Graph Matching.,"Haggai Maron,Yaron Lipman,"
38,Deep Defense: Training DNNs with Improved Adversarial Robustness.,"Ziang Yan,Yiwen Guo,Changshui Zhang,"
39,Rest-Katyusha: Exploiting the Solution's Structure via Scheduled Restart Schemes.,"Junqi Tang,Mohammad Golbabaee,Francis R. Bach,Mike E. Davies,"
40,Implicit Reparameterization Gradients.,"Mikhail Figurnov,Shakir Mohamed,Andriy Mnih,"
41,Training DNNs with Hybrid Block Floating Point.,"Mario Drumond,Tao Lin,Martin Jaggi,Babak Falsafi,"
42,A Model for Learned Bloom Filters and Optimizing by Sandwiching.,"Michael Mitzenmacher,"
43,Soft-Gated Warping-GAN for Pose-Guided Person Image Synthesis.,"Haoye Dong,Xiaodan Liang,Ke Gong,Hanjiang Lai,Jia Zhu,Jian Yin,"
44,Deep Functional Dictionaries: Learning Consistent Semantic Structures on 3D Models from Functions.,"Minhyuk Sung,Hao Su,Ronald Yu,Leonidas J. Guibas,"
45,"Nonlocal Neural Networks, Nonlocal Diffusion and Nonlocal Modeling.","Yunzhe Tao,Qi Sun,Qiang Du,Wei Liu,"
46,Are ResNets Provably Better than Linear Predictors?,"Ohad Shamir,"
47,Learning to Decompose and Disentangle Representations for Video Prediction.,"Jun-Ting Hsieh,Bingbin Liu,De-An Huang,Fei-Fei Li,Juan Carlos Niebles,"
48,Multi-Task Learning as Multi-Objective Optimization.,"Ozan Sener,Vladlen Koltun,"
49,Combinatorial Optimization with Graph Convolutional Networks and Guided Tree Search.,"Zhuwen Li,Qifeng Chen,Vladlen Koltun,"
50,Self-Erasing Network for Integral Object Attention.,"Qibin Hou,Peng-Tao Jiang,Yunchao Wei,Ming-Ming Cheng,"
51,LinkNet: Relational Embedding for Scene Graph.,"Sanghyun Woo,Dahun Kim,Donghyeon Cho,In So Kweon,"
52,How to Start Training: The Effect of Initialization and Architecture.,"Boris Hanin,David Rolnick,"
53,Which Neural Net Architectures Give Rise to Exploding and Vanishing Gradients?,"Boris Hanin,"
54,Explanations based on the Missing: Towards Contrastive Explanations with Pertinent Negatives.,"Amit Dhurandhar,Pin-Yu Chen,Ronny Luss,Chun-Chen Tu,Pai-Shun Ting,Karthikeyan Shanmugam,Payel Das,"
55,HitNet: Hybrid Ternary Recurrent Neural Network.,"Peiqi Wang,Xinfeng Xie,Lei Deng,Guoqi Li,Dongsheng Wang,Yuan Xie,"
56,A Unified Framework for Extensive-Form Game Abstraction with Bounds.,"Christian Kroer,Tuomas Sandholm,"
57,Removing the Feature Correlation Effect of Multiplicative Noise.,"Zijun Zhang,Yining Zhang,Zongpeng Li,"
58,Maximum-Entropy Fine Grained Classification.,"Abhimanyu Dubey,Otkrist Gupta,Ramesh Raskar,Nikhil Naik,"
59,On Learning Markov Chains.,"Yi Hao,Alon Orlitsky,Venkatadheeraj Pichapati,"
60,A Neural Compositional Paradigm for Image Captioning.,"Bo Dai,Sanja Fidler,Dahua Lin,"
61,Quantifying Learning Guarantees for Convex but Inconsistent Surrogates.,"Kirill Struminsky,Simon Lacoste-Julien,Anton Osokin,"
62,Dialog-based Interactive Image Retrieval.,"Xiaoxiao Guo,Hui Wu,Yu Cheng,Steven Rennie,Gerald Tesauro,Rogério Schmidt Feris,"
63,SPIDER: Near-Optimal Non-Convex Optimization via Stochastic Path-Integrated Differential Estimator.,"Cong Fang,Chris Junchi Li,Zhouchen Lin,Tong Zhang,"
64,Are GANs Created Equal? A Large-Scale Study.,"Mario Lucic,Karol Kurach,Marcin Michalski,Sylvain Gelly,Olivier Bousquet,"
65,Learning Disentangled Joint Continuous and Discrete Representations.,"Emilien Dupont,"
66,TADAM: Task dependent adaptive metric for improved few-shot learning.,"Boris N. Oreshkin,Pau Rodríguez López,Alexandre Lacoste,"
67,"Do Less, Get More: Streaming Submodular Maximization with Subsampling.","Moran Feldman,Amin Karbasi,Ehsan Kazemi,"
68,Sparse Covariance Modeling in High Dimensions with Gaussian Processes.,"Rui Li,Kishan KC,Feng Cui,Justin Domke,Anne R. Haake,"
69,Deep Neural Nets with Interpolating Function as Output Activation.,"Bao Wang,Xiyang Luo,Zhen Li,Wei Zhu,Zuoqiang Shi,Stanley J. Osher,"
70,"FishNet: A Versatile Backbone for Image, Region, and Pixel Level Prediction.","Shuyang Sun,Jiangmiao Pang,Jianping Shi,Shuai Yi,Wanli Ouyang,"
71,Visual Memory for Robust Path Following.,"Ashish Kumar,Saurabh Gupta,David F. Fouhey,Sergey Levine,Jitendra Malik,"
72,KDGAN: Knowledge Distillation with Generative Adversarial Networks.,"Xiaojie Wang,Rui Zhang,Yu Sun,Jianzhong Qi,"
73,Long short-term memory and Learning-to-learn in networks of spiking neurons.,"Guillaume Bellec,Darjan Salaj,Anand Subramoney,Robert A. Legenstein,Wolfgang Maass,"
74,Greedy Hash: Towards Fast Optimization for Accurate Hash Coding in CNN.,"Shupeng Su,Chao Zhang,Kai Han,Yonghong Tian,"
75,Informative Features for Model Comparison.,"Wittawat Jitkrittum,Heishiro Kanagawa,Patsorn Sangkloy,James Hays,Bernhard Schölkopf,Arthur Gretton,"
76,PointCNN: Convolution On X-Transformed Points.,"Yangyan Li,Rui Bu,Mingchao Sun,Wei Wu,Xinhan Di,Baoquan Chen,"
77,Connectionist Temporal Classification with Maximum Entropy Regularization.,"Hu Liu,Sheng Jin,Changshui Zhang,"
78,Large Margin Deep Networks for Classification.,"Gamaleldin F. Elsayed,Dilip Krishnan,Hossein Mobahi,Kevin Regan,Samy Bengio,"
79,Generalizing Graph Matching beyond Quadratic Assignment Model.,"Tianshu Yu,Junchi Yan,Yilin Wang,Wei Liu,Baoxin Li,"
80,Solving Large Sequential Games with the Excessive Gap Technique.,"Christian Kroer,Gabriele Farina,Tuomas Sandholm,"
81,Discrimination-aware Channel Pruning for Deep Neural Networks.,"Zhuangwei Zhuang,Mingkui Tan,Bohan Zhuang,Jing Liu,Yong Guo,Qingyao Wu,Junzhou Huang,Jin-Hui Zhu,"
82,On the Dimensionality of Word Embedding.,"Zi Yin,Yuanyuan Shen,"
83,Reinforced Continual Learning.,"Ju Xu,Zhanxing Zhu,"
84,Uncertainty-Aware Attention for Reliable Interpretation and Prediction.,"Jay Heo,Haebeom Lee,Saehoon Kim,Juho Lee,Kwang Joon Kim,Eunho Yang,Sung Ju Hwang,"
85,DropMax: Adaptive Variational Softmax.,"Haebeom Lee,Juho Lee,Saehoon Kim,Eunho Yang,Sung Ju Hwang,"
86,Posterior Concentration for Sparse Deep Learning.,"Veronika Rocková,Nicholas Polson,"
87,A flexible model for training action localization with varying levels of supervision.,"Guilhem Chéron,Jean-Baptiste Alayrac,Ivan Laptev,Cordelia Schmid,"
88,A Deep Bayesian Policy Reuse Approach Against Non-Stationary Agents.,"Yan Zheng,Zhaopeng Meng,Jianye Hao,Zongzhang Zhang,Tianpei Yang,Changjie Fan,"
89,Empirical Risk Minimization in Non-interactive Local Differential Privacy Revisited.,"Di Wang,Marco Gaboardi,Jinhui Xu,"
90,Low-shot Learning via Covariance-Preserving Adversarial Augmentation Networks.,"Hang Gao,Zheng Shou,Alireza Zareian,Hanwang Zhang,Shih-Fu Chang,"
91,Learning semantic similarity in a continuous space.,"Michel Deudon,"
92,MetaReg: Towards Domain Generalization using Meta-Regularization.,"Yogesh Balaji,Swami Sankaranarayanan,Rama Chellappa,"
93,Boosted Sparse and Low-Rank Tensor Regression.,"Lifang He,Kun Chen,Wanwan Xu,Jiayu Zhou,Fei Wang,"
94,Domain-Invariant Projection Learning for Zero-Shot Recognition.,"An Zhao,Mingyu Ding,Jiechao Guan,Zhiwu Lu,Tao Xiang,Ji-Rong Wen,"
95,Neural-Symbolic VQA: Disentangling Reasoning from Vision and Language Understanding.,"Kexin Yi,Jiajun Wu,Chuang Gan,Antonio Torralba,Pushmeet Kohli,Josh Tenenbaum,"
96,Frequency-Domain Dynamic Pruning for Convolutional Neural Networks.,"Zhenhua Liu,Jizheng Xu,Xiulian Peng,Ruiqin Xiong,"
97,Quadratic Decomposable Submodular Function Minimization.,"Pan Li,Niao He,Olgica Milenkovic,"
98,A Block Coordinate Ascent Algorithm for Mean-Variance Optimization.,"Tengyang Xie,Bo Liu,Yangyang Xu,Mohammad Ghavamzadeh,Yinlam Chow,Daoming Lyu,Daesub Yoon,"
99,\ell_1-regression with Heavy-tailed Distributions.,"Lijun Zhang,Zhi-Hua Zhou,"
100,Neural Nearest Neighbors Networks.,"Tobias Plötz,Stefan Roth,"
101,Efficient nonmyopic batch active search.,"Shali Jiang,Gustavo Malkomes,Matthew Abbott,Benjamin Moseley,Roman Garnett,"
102,A Game-Theoretic Approach to Recommendation Systems with Strategic Content Providers.,"Omer Ben-Porat,Moshe Tennenholtz,"
103,Interactive Structure Learning with Structural Query-by-Committee.,"Christopher Tosh,Sanjoy Dasgupta,"
104,Global Geometry of Multichannel Sparse Blind Deconvolution on the Sphere.,"Yanjun Li,Yoram Bresler,"
105,Video-to-Video Synthesis.,"Ting-Chun Wang,Ming-Yu Liu,Jun-Yan Zhu,Nikolai Yakovenko,Andrew Tao,Jan Kautz,Bryan Catanzaro,"
106,How To Make the Gradients Small Stochastically: Even Faster Convex and Nonconvex SGD.,"Zeyuan Allen-Zhu,"
107,Synthesize Policies for Transfer and Adaptation across Tasks and Environments.,"Hexiang Hu,Liyu Chen,Boqing Gong,Fei Sha,"
108,Adversarial vulnerability for any classifier.,"Alhussein Fawzi,Hamza Fawzi,Omar Fawzi,"
109,Evolution-Guided Policy Gradient in Reinforcement Learning.,"Shauharda Khadka,Kagan Tumer,"
110,Toddler-Inspired Visual Object Learning.,"Sven Bambach,David J. Crandall,Linda B. Smith,Chen Yu,"
111,"Alternating optimization of decision trees, with application to learning sparse oblique trees.","Miguel Á. Carreira-Perpiñán,Pooya Tavallali,"
112,FD-GAN: Pose-guided Feature Distilling GAN for Robust Person Re-identification.,"Yixiao Ge,Zhuowan Li,Haiyu Zhao,Guojun Yin,Shuai Yi,Xiaogang Wang,Hongsheng Li,"
113,New Insight into Hybrid Stochastic Gradient Descent: Beyond With-Replacement Sampling and Convexity.,"Pan Zhou,Xiaotong Yuan,Jiashi Feng,"
114,The Lingering of Gradients: How to Reuse Gradients Over Time.,"Zeyuan Allen-Zhu,David Simchi-Levi,Xinshang Wang,"
115,Unsupervised Learning of View-invariant Action Representations.,"Junnan Li,Yongkang Wong,Qi Zhao,Mohan S. Kankanhalli,"
116,Fairness Behind a Veil of Ignorance: A Welfare Analysis for Automated Decision Making.,"Hoda Heidari,Claudio Ferrari,Krishna P. Gummadi,Andreas Krause,"
117,Global Gated Mixture of Second-order Pooling for Improving Deep Convolutional Neural Networks.,"Qilong Wang,Zilin Gao,Jiangtao Xie,Wangmeng Zuo,Peihua Li,"
118,Image-to-image translation for cross-domain disentanglement.,"Abel Gonzalez-Garcia,Joost van de Weijer,Yoshua Bengio,"
119,Gradient Sparsification for Communication-Efficient Distributed Optimization.,"Jianqiao Wangni,Jialei Wang,Ji Liu,Tong Zhang,"
120,Revisiting Multi-Task Learning with ROCK: a Deep Residual Auxiliary Block for Visual Detection.,"Taylor Mordan,Nicolas Thome,Gilles Hénaff,Matthieu Cord,"
121,Adaptive Online Learning in Dynamic Environments.,"Lijun Zhang,Shiyin Lu,Zhi-Hua Zhou,"
122,FRAGE: Frequency-Agnostic Word Representation.,"ChengYue Gong,Di He,Xu Tan,Tao Qin,Liwei Wang,Tie-Yan Liu,"
123,Generative Neural Machine Translation.,"Harshil Shah,David Barber,"
124,Found Graph Data and Planted Vertex Covers.,"Austin R. Benson,Jon M. Kleinberg,"
125,Joint Active Feature Acquisition and Classification with Variable-Size Set Encoding.,"Hajin Shim,Sung Ju Hwang,Eunho Yang,"
126,Regularization Learning Networks: Deep Learning for Tabular Datasets.,"Ira Shavitt,Eran Segal,"
127,Multitask Boosting for Survival Analysis with Competing Risks.,"Alexis Bellot,Mihaela van der Schaar,"
128,Geometry Based Data Generation.,"Ofir Lindenbaum,Jay S. Stanley III,Guy Wolf,Smita Krishnaswamy,"
129,SLAYER: Spike Layer Error Reassignment in Time.,"Sumit Bam Shrestha,Garrick Orchard,"
130,On Oracle-Efficient PAC RL with Rich Observations.,"Christoph Dann,Nan Jiang,Akshay Krishnamurthy,Alekh Agarwal,John Langford,Robert E. Schapire,"
131,Gradient Descent for Spiking Neural Networks.,"Dongsung Huh,Terrence J. Sejnowski,"
132,Generalizing Tree Probability Estimation via Bayesian Networks.,"Cheng Zhang,Frederick A. Matsen IV,"
133,Where Do You Think You're Going?: Inferring Beliefs about Dynamics from Behavior.,"Siddharth Reddy,Anca D. Dragan,Sergey Levine,"
134,Designing by Training: Acceleration Neural Network for Fast High-Dimensional Convolution.,"Longquan Dai,Liang Tang,Yuan Xie,Jinhui Tang,"
135,Understanding the Role of Adaptivity in Machine Teaching: The Case of Version Space Learners.,"Yuxin Chen,Adish Singla,Oisin Mac Aodha,Pietro Perona,Yisong Yue,"
136,A loss framework for calibrated anomaly detection.,
137,PacGAN: The power of two samples in generative adversarial networks.,"Zinan Lin,Ashish Khetan,Giulia C. Fanti,Sewoong Oh,"
138,Variational Memory Encoder-Decoder.,"Hung Le,Truyen Tran,Thin Nguyen,Svetha Venkatesh,"
139,Stochastic Composite Mirror Descent: Optimal Bounds with High Probabilities.,"Yunwen Lei,Ke Tang,"
140,Hybrid Retrieval-Generation Reinforced Agent for Medical Image Report Generation.,"Yuan Li,Xiaodan Liang,Zhiting Hu,Eric P. Xing,"
141,Overcoming Language Priors in Visual Question Answering with Adversarial Regularization.,"Sainandan Ramakrishnan,Aishwarya Agrawal,Stefan Lee,"
142,Hybrid Knowledge Routed Modules for Large-scale Object Detection.,"Chenhan Jiang,Hang Xu,Xiaodan Liang,Liang Lin,"
143,Bilinear Attention Networks.,"Jin-Hwa Kim,Jaehyun Jun,Byoung-Tak Zhang,"
144,Parsimonious Quantile Regression of Financial Asset Tail Dynamics via Sequential Learning.,"Xing Yan,Weizhong Zhang,Lin Ma,Wei Liu,Qi Wu,"
145,Multi-Class Learning: From Theory to Algorithm.,"Jian Li,Yong Liu,Rong Yin,Hua Zhang,Lizhong Ding,Weiping Wang,"
146,Multivariate Time Series Imputation with Generative Adversarial Networks.,"Yonghong Luo,Xiangrui Cai,Ying Zhang,Jun Xu,Xiaojie Yuan,"
147,Learning Versatile Filters for Efficient Convolutional Neural Networks.,"Yunhe Wang,Chang Xu,Chunjing Xu,Chao Xu,Dacheng Tao,"
148,Accelerated Stochastic Matrix Inversion: General Theory and Speeding up BFGS Rules for Faster Second-Order Optimization.,"Robert M. Gower,Filip Hanzely,Peter Richtárik,Sebastian U. Stich,"
149,DifNet: Semantic Segmentation by Diffusion Networks.,"Peng Jiang,Fanglin Gu,Yunhai Wang,Changhe Tu,Baoquan Chen,"
150,Conditional Adversarial Domain Adaptation.,"Mingsheng Long,Zhangjie Cao,Jianmin Wang,Michael I. Jordan,"
151,Neighbourhood Consensus Networks.,"Ignacio Rocco,Mircea Cimpoi,Relja Arandjelovic,Akihiko Torii,Tomás Pajdla,Josef Sivic,"
152,Relating Leverage Scores and Density using Regularized Christoffel Functions.,"Edouard Pauwels,Francis R. Bach,Jean-Philippe Vert,"
153,Non-Local Recurrent Network for Image Restoration.,"Ding Liu,Bihan Wen,Yuchen Fan,Chen Change Loy,Thomas S. Huang,"
154,Bayesian Semi-supervised Learning with Graph Gaussian Processes.,"Yin Cheng Ng,Nicolò Colombo,Ricardo Silva,"
155,Foreground Clustering for Joint Segmentation and Localization in Videos and Images.,"Abhishek Sharma,"
156,Video Prediction via Selective Sampling.,"Jingwei Xu,Bingbing Ni,Xiaokang Yang,"
157,Distilled Wasserstein Learning for Word Embedding and Topic Modeling.,"Hongteng Xu,Wenlin Wang,Wei Liu,Lawrence Carin,"
158,Learning to Exploit Stability for 3D Scene Parsing.,"Yilun Du,Zhijian Liu,Hector Basevi,Ales Leonardis,Bill Freeman,Josh Tenenbaum,Jiajun Wu,"
159,Neural Guided Constraint Logic Programming for Program Synthesis.,"Lisa Zhang,Gregory Rosenblatt,Ethan Fetaya,Renjie Liao,William E. Byrd,Matthew Might,Raquel Urtasun,Richard S. Zemel,"
160,Genetic-Gated Networks for Deep Reinforcement Learning.,"Simyung Chang,John Yang,Jaeseok Choi,Nojun Kwak,"
161,Fighting Boredom in Recommender Systems with Linear Reinforcement Learning.,"Romain Warlop,Alessandro Lazaric,Jérémie Mary,"
162,Enhancing the Accuracy and Fairness of Human Decision Making.,"Isabel Valera,Adish Singla,Manuel Gomez Rodriguez,"
163,Temporal Regularization for Markov Decision Process.,"Pierre Thodoroff,Audrey Durand,Joelle Pineau,Doina Precup,"
164,The Pessimistic Limits and Possibilities of Margin-based Losses in Semi-supervised Learning.,"Jesse H. Krijthe,Marco Loog,"
165,Simple random search of static linear policies is competitive for reinforcement learning.,"Horia Mania,Aurelia Guy,Benjamin Recht,"
166,Generating Informative and Diverse Conversational Responses via Adversarial Information Maximization.,"Yizhe Zhang,Michel Galley,Jianfeng Gao,Zhe Gan,Xiujun Li,Chris Brockett,Bill Dolan,"
167,Entropy and mutual information in models of deep neural networks.,"Marylou Gabrié,Andre Manoel,Clément Luneau,Jean Barbier,Nicolas Macris,Florent Krzakala,Lenka Zdeborová,"
168,Collaborative Learning for Deep Neural Networks.,"Guocong Song,Wei Chai,"
169,High Dimensional Linear Regression using Lattice Basis Reduction.,"Ilias Zadik,David Gamarnik,"
170,Symbolic Graph Reasoning Meets Convolutions.,"Xiaodan Liang,Zhiting Hu,Hao Zhang,Liang Lin,Eric P. Xing,"
171,DVAE#: Discrete Variational Autoencoders with Relaxed Boltzmann Priors.,"Arash Vahdat,Evgeny Andriyash,William G. Macready,"
172,Partially-Supervised Image Captioning.,"Peter Anderson,Stephen Gould,Mark Johnson,"
173,3D-Aware Scene Manipulation via Inverse Graphics.,"Shunyu Yao,Tzu-Ming Harry Hsu,Jun-Yan Zhu,Jiajun Wu,Antonio Torralba,Bill Freeman,Josh Tenenbaum,"
174,Random Feature Stein Discrepancies.,"Jonathan H. Huggins,Lester Mackey,"
175,Distributed Stochastic Optimization via Adaptive SGD.,"Ashok Cutkosky,Róbert Busa-Fekete,"
176,Precision and Recall for Time Series.,"Nesime Tatbul,Tae Jun Lee,Stan Zdonik,Mejbah Alam,Justin Gottschlich,"
177,Deep Attentive Tracking via Reciprocative Learning.,"Shi Pu,Yibing Song,Chao Ma,Honggang Zhang,Ming-Hsuan Yang,"
178,Virtual Class Enhanced Discriminative Embedding Learning.,"Binghui Chen,Weihong Deng,Haifeng Shen,"
179,Attention in Convolutional LSTM for Gesture Recognition.,"Liang Zhang,Guangming Zhu,Lin Mei,Peiyi Shen,Syed Afaq Ali Shah,Mohammed Bennamoun,"
180,Pelee: A Real-Time Object Detection System on Mobile Devices.,"Jun Wang,Tanner A. Bohn,Charles X. Ling,"
181,Universal Growth in Production Economies.,"Simina Brânzei,Ruta Mehta,Noam Nisan,"
182,Bayesian Model Selection Approach to Boundary Detection with Non-Local Priors.,"Fei Jiang,Guosheng Yin,Francesca Dominici,"
183,Efficient Stochastic Gradient Hard Thresholding.,"Pan Zhou,Xiaotong Yuan,Jiashi Feng,"
184,SplineNets: Continuous Neural Decision Graphs.,"Cem Keskin,Shahram Izadi,"
185,Generalized Zero-Shot Learning with Deep Calibration Network.,"Shichen Liu,Mingsheng Long,Jianmin Wang,Michael I. Jordan,"
186,Neural Architecture Search with Bayesian Optimisation and Optimal Transport.,"Kirthevasan Kandasamy,Willie Neiswanger,Jeff Schneider,Barnabás Póczos,Eric P. Xing,"
187,Embedding Logical Queries on Knowledge Graphs.,"William L. Hamilton,Payal Bajaj,Marinka Zitnik,Dan Jurafsky,Jure Leskovec,"
188,Learning Optimal Reserve Price against Non-myopic Bidders.,"Jinyan Liu,Zhiyi Huang,Xiangning Wang,"
189,Sequential Context Encoding for Duplicate Removal.,"Lu Qi,Shu Liu,Jianping Shi,Jiaya Jia,"
190,Discovery of Latent 3D Keypoints via End-to-end Geometric Reasoning.,"Supasorn Suwajanakorn,Noah Snavely,Jonathan Tompson,Mohammad Norouzi,"
191,Nonparametric learning from Bayesian models with randomized objective functions.,"Simon Lyddon,Stephen Walker,Chris C. Holmes,"
192,SEGA: Variance Reduction via Gradient Sketching.,"Filip Hanzely,Konstantin Mishchenko,Peter Richtárik,"
193,Automatic Program Synthesis of Long Programs with a Learned Garbage Collector.,"Amit Zohar,Lior Wolf,"
194,One-Shot Unsupervised Cross Domain Translation.,"Sagie Benaim,Lior Wolf,"
195,Regularizing by the Variance of the Activations' Sample-Variances.,"Etai Littwin,Lior Wolf,"
196,"Overlapping Clustering Models, and One (class) SVM to Bind Them All.","Xueyu Mao,Purnamrita Sarkar,Deepayan Chakrabarti,"
197,Algorithmic Linearly Constrained Gaussian Processes.,"Markus Lange-Hegermann,"
198,DeepExposure: Learning to Expose Photos with Asynchronously Reinforced Adversarial Learning.,"Runsheng Yu,Wenyu Liu,Yasen Zhang,Zhi Qu,Deli Zhao,Bo Zhang,"
199,Norm matters: efficient and accurate normalization schemes in deep networks.,"Elad Hoffer,Ron Banner,Itay Golan,Daniel Soudry,"
200,Dual Principal Component Pursuit: Improved Analysis and Efficient Algorithms.,"Zhihui Zhu,Yifan Wang,Daniel P. Robinson,Daniel Q. Naiman,René Vidal,Manolis C. Tsakiris,"
201,MULAN: A Blind and Off-Grid Method for Multichannel Echo Retrieval.,"Helena Peic Tukuljac,Antoine Deleforge,Rémi Gribonval,"
202,Mixture Matrix Completion.,"Daniel L. Pimentel-Alarcón,"
203,Trajectory Convolution for Action Recognition.,"Yue Zhao,Yuanjun Xiong,Dahua Lin,"
204,The Description Length of Deep Learning models.,"Léonard Blier,Yann Ollivier,"
205,A Smoothed Analysis of the Greedy Algorithm for the Linear Contextual Bandit Problem.,"Sampath Kannan,Jamie H. Morgenstern,Aaron Roth,Bo Waggoner,Zhiwei Steven Wu,"
206,Revisiting Decomposable Submodular Function Minimization with Incidence Relations.,"Pan Li,Olgica Milenkovic,"
207,A Practical Algorithm for Distributed Clustering and Outlier Detection.,"Jiecao Chen,Erfan Sadeqi Azer,Qin Zhang,"
208,Learning to Reconstruct Shapes from Unseen Classes.,"Xiuming Zhang,Zhoutong Zhang,Chengkai Zhang,Josh Tenenbaum,Bill Freeman,Jiajun Wu,"
209,BourGAN: Generative Networks with Metric Embeddings.,"Chang Xiao,Peilin Zhong,Changxi Zheng,"
210,Smoothed analysis of the low-rank approach for smooth semidefinite programs.,"Thomas Pumir,Samy Jelassi,Nicolas Boumal,"
211,Zero-Shot Transfer with Deictic Object-Oriented Representation in Reinforcement Learning.,"Ofir Marom,Benjamin Rosman,"
212,Overfitting or perfect fitting? Risk bounds for classification and regression rules that interpolate.,"Mikhail Belkin,Daniel J. Hsu,Partha Mitra,"
