,0,1,2,3
0,Finding Task-Relevant Features for Few-Shot Learning by Category Traversal,"Few-shot learning is an important area of research.  Conceptually, humans are readily able to understand new concepts given just a few examples, while in more pragmatic terms, limited-example training situations are common practice. Recent effective approaches to few-shot learning employ a metric-learning framework to learn a feature similarity comparison between a query (test) example, and the few support (training) examples.  However, these approaches treat each support class independently from one another, never looking at the entire task as a whole.  Because of this, they are constrained to use a single set of features for all possible test-time tasks, which hinders the ability to distinguish the most relevant dimensions for the task at hand.  In this work, we introduce a Category Traversal Module that can be inserted as a plug-and-play module into most metric-learning based few-shot learners.  This component traverses across the entire support set at once, identifying task-relevant features based on both intra-class commonality and inter-class uniqueness in the feature space.  Incorporating our module improves performance considerably (5%-10% relative) over baseline systems on both miniImageNet and tieredImageNet benchmarks, with overall performance competitive with the most recent state-of-the-art systems.",http://openaccess.thecvf.com//www.cv-foundation.org/,"Finding,Task-Relevant,Features,for,Few-Shot,Learning,by,Category,Traversal"
1,Edge-Labeling Graph Neural Network for Few-Shot Learning,"In this paper, we propose a novel edge-labeling graph neural network (EGNN), which adapts a deep neural network on the edge-labeling graph, for few-shot learning. The previous graph neural network (GNN) approaches in few-shot learning have been based on the node-labeling framework, which implicitly models the intra-cluster similarity and the inter-cluster dissimilarity. In contrast, the proposed EGNN learns to predict the edge-labels rather than the node-labels on the graph that enables the evolution of an explicit clustering by iteratively updating the edge-labels with direct exploitation of both intra-cluster similarity and the inter-cluster dissimilarity. It is also well suited for performing on various numbers of classes without retraining, and can be easily extended to perform a transductive inference. The parameters of the EGNN are learned by episodic training with an edge-labeling loss to obtain a well-generalizable model for unseen low-data problem. On both of the supervised and semi-supervised few-shot image classification tasks with two benchmark datasets, the proposed EGNN significantly improves the performances over the existing GNNs.",http://openaccess.thecvf.com//www.cv-foundation.org/,"Edge-Labeling,Graph,Neural,Network,for,Few-Shot,Learning"
2,Generating Classification Weights With GNN Denoising Autoencoders for Few-Shot Learning,"Given an initial recognition model already trained on a set of base classes, the goal of this work is to develop a meta-model for few-shot learning. The meta-model, given as input some novel classes with few training examples per class, must properly adapt the existing recognition model into a new model that can correctly classify in a unified way both the novel and the base classes. To accomplish this goal it must learn to output the appropriate classification weight vectors for those two types of classes. To build our meta-model we make use of two main innovations: we propose the use of a Denoising Autoencoder network (DAE) that (during training) takes as input a set of classification weights corrupted with Gaussian noise and learns to reconstruct the target-discriminative classification weights. In this case, the injected noise on the classification weights serves the role of regularizing the weight generating meta-model. Furthermore, in order to capture the co-dependencies between different classes in a given task instance of our meta-model, we propose to implement the DAE model as a Graph Neural Network (GNN). In order to verify the efficacy of our approach, we extensively evaluate it on ImageNet based few-shot benchmarks and we report state-of-the-art results.",http://openaccess.thecvf.com//www.cv-foundation.org/,"Generating,Classification,Weights,With,GNN,Denoising,Autoencoders,for,Few-Shot,Learning"
3,Kervolutional Neural Networks,"Convolutional neural networks (CNNs) have enabled the state-of-the-art performance in many computer vision tasks. However, little effort has been devoted to establishing convolution in non-linear space. Existing works mainly leverage on the activation layers, which can only provide point-wise non-linearity. To solve this problem, a new operation, kervolution (kernel convolution), is introduced to approximate complex behaviors of human perception systems leveraging on the kernel trick. It generalizes convolution, enhances the model capacity, and captures higher order interactions of features, via patch-wise kernel functions, but without introducing additional parameters. Extensive experiments show that kervolutional neural networks (KNN) achieve higher accuracy and faster convergence than baseline CNN.",http://openaccess.thecvf.com//www.cv-foundation.org/,"Kervolutional,Neural,Networks"
4,Why ReLU Networks Yield High-Confidence Predictions Far Away From the Training Data and How to Mitigate the Problem,"Classifiers used in the wild, in particular for safety-critical systems, should not only have good generalization properties but also should know when they don't know, in particular make low confidence predictions far away from the training data. We show that ReLU type neural networks which yield a piecewise linear classifier function fail in this regard as they produce almost always high confidence predictions far away from the training data. For bounded domains like images we propose a new robust optimization technique similar to adversarial training which enforces low confidence predictions far away from the training data. We show that this technique is surprisingly effective in reducing the confidence of predictions far away from the training data while maintaining high confidence predictions and test error on the original classification task compared to standard training.",http://openaccess.thecvf.com//www.cv-foundation.org/,"Why,ReLU,Networks,Yield,High-Confidence,Predictions,Far,Away,From,the,Training,Data,and,How,to,Mitigate,the,Problem"
5,On the Structural Sensitivity of Deep Convolutional Networks to the Directions of Fourier Basis Functions,"Data-agnostic quasi-imperceptible perturbations on inputs are known to degrade recognition accuracy of deep convolutional networks severely. This phenomenon is considered to be a potential security issue. Moreover, some results on statistical generalization guarantees indicate that the phenomena can be a key to improve the networks' generalization. However, the characteristics of the shared directions of such harmful perturbations remain unknown. Our primal finding is that convolutional networks are sensitive to the directions of Fourier basis functions. We derived the property by specializing a hypothesis of the cause of the sensitivity, known as the linearity of neural networks, to convolutional networks and empirically validated it. As a byproduct of the analysis, we propose an algorithm to create shift-invariant universal adversarial perturbations available in black-box settings.",http://openaccess.thecvf.com//www.cv-foundation.org/,"On,the,Structural,Sensitivity,of,Deep,Convolutional,Networks,to,the,Directions,of,Fourier,Basis,Functions"
6,Neural Rejuvenation: Improving Deep Network Training by Enhancing Computational Resource Utilization,"In this paper, we study the problem of improving computational resource utilization of neural networks. Deep neural networks are usually over-parameterized for their tasks in order to achieve good performances, thus are likely to have underutilized computational resources. This observation motivates a lot of research topics, e.g. network pruning, architecture search, etc. As models with higher computational costs (e.g. more parameters or more computations) usually have better performances, we study the problem of improving the resource utilization of neural networks so that their potentials can be further realized. To this end, we propose a novel optimization method named Neural Rejuvenation. As its name suggests, our method detects dead neurons and computes resource utilization in real time, rejuvenates dead neurons by resource reallocation and reinitialization, and trains them with new training schemes. By simply replacing standard optimizers with Neural Rejuvenation, we are able to improve the performances of neural networks by a very large margin while using similar training efforts and maintaining their original resource usages. The code is available here: https://github.com/joe-siyuan-qiao/NeuralRejuvenation-CVPR19",http://openaccess.thecvf.com//www.cv-foundation.org/,"Neural,Rejuvenation:,Improving,Deep,Network,Training,by,Enhancing,Computational,Resource,Utilization"
7,Hardness-Aware Deep Metric Learning,"This paper presents a hardness-aware deep metric learning (HDML) framework. Most previous deep metric learning methods employ the hard negative mining strategy to alleviate the lack of informative samples for training. However, this mining strategy only utilizes a subset of training data, which may not be enough to characterize the global geometry of the embedding space comprehensively. To address this problem, we perform linear interpolation on embeddings to adaptively manipulate their hard levels and generate corresponding label-preserving synthetics for recycled training, so that information buried in all samples can be fully exploited and the metric is always challenged with proper difficulty. Our method achieves very competitive performance on the widely used CUB-200-2011, Cars196, and Stanford Online Products datasets.",http://openaccess.thecvf.com//www.cv-foundation.org/,"Hardness-Aware,Deep,Metric,Learning"
8,Auto-DeepLab: Hierarchical Neural Architecture Search for Semantic Image Segmentation,"Recently, Neural Architecture Search (NAS) has successfully identified neural network architectures that exceed human designed ones on large-scale image classification. In this paper, we study NAS for semantic image segmentation. Existing works often focus on searching the repeatable cell structure, while hand-designing the outer network structure that controls the spatial resolution changes. This choice simplifies the search space, but becomes increasingly problematic for dense image prediction which exhibits a lot more network level architectural variations. Therefore, we propose to search the network level structure in addition to the cell level structure, which forms a hierarchical architecture search space. We present a network level search space that includes many popular designs, and develop a formulation that allows efficient gradient-based architecture search (3 P100 GPU days on Cityscapes images). We demonstrate the effectiveness of the proposed method on the challenging Cityscapes, PASCAL VOC 2012, and ADE20K datasets. Auto-DeepLab, our architecture searched specifically for semantic image segmentation, attains state-of-the-art performance without any ImageNet pretraining.",http://openaccess.thecvf.com//www.cv-foundation.org/,"Auto-DeepLab:,Hierarchical,Neural,Architecture,Search,for,Semantic,Image,Segmentation"
9,Learning Loss for Active Learning,"The performance of deep neural networks improves with more annotated data. The problem is that the budget for annotation is limited. One solution to this is active learning, where a model asks human to annotate data that it perceived as uncertain. A variety of recent methods have been proposed to apply active learning to deep networks but most of them are either designed specific for their target tasks or computationally inefficient for large networks. In this paper, we propose a novel active learning method that is simple but task-agnostic, and works efficiently with the deep networks. We attach a small parametric module, named ""loss prediction module,"" to a target network, and learn it to predict target losses of unlabeled inputs. Then, this module can suggest data that the target model is likely to produce a wrong prediction. This method is task-agnostic as networks are learned from a single loss regardless of target tasks. We rigorously validate our method through image classification, object detection, and human pose estimation, with the recent network architectures. The results demonstrate that our method consistently outperforms the previous methods over the tasks.",http://openaccess.thecvf.com//www.cv-foundation.org/,"Learning,Loss,for,Active,Learning"
10,Striking the Right Balance With Uncertainty,"Learning unbiased models on imbalanced datasets is a significant challenge. Rare classes tend to get a concentrated representation in the classification space which hampers the generalization of learned boundaries to new test examples. In this paper, we demonstrate that the Bayesian uncertainty estimates directly correlate with the rarity of classes and the difficulty level of individual samples. Subsequently, we present a novel framework for uncertainty based class imbalance learning that follows two key insights: First, classification boundaries should be extended further away from a more uncertain (rare) class to avoid over-fitting and enhance its generalization. Second, each sample should be modeled as a multi-variate Gaussian distribution with a mean vector and a covariance matrix defined by the sample's uncertainty. The learned boundaries should respect not only the individual samples but also their distribution in the feature space. Our proposed approach efficiently utilizes sample and class uncertainty information to learn robust features and more generalizable classifiers. We systematically study the class imbalance problem and derive a novel loss formulation for max-margin learning based on Bayesian uncertainty measure. The proposed method shows significant performance improvements on six benchmark datasets for face verification, attribute prediction, digit/object classification and skin lesion detection.",http://openaccess.thecvf.com//www.cv-foundation.org/,"Striking,the,Right,Balance,With,Uncertainty"
11,AutoAugment: Learning Augmentation Strategies From Data,"Data augmentation is an effective technique for improving the accuracy of modern image classifiers. However, current data augmentation implementations are manually designed. In this paper, we describe a simple procedure called AutoAugment to automatically search for improved data augmentation policies. In our implementation, we have designed a search space where a policy consists of many sub-policies, one of which is randomly chosen for each image in each mini-batch. A sub-policy consists of two operations, each operation being an image processing function such as translation, rotation, or shearing, and the probabilities and magnitudes with which the functions are applied.  We use a search algorithm to find the best policy such that the neural network yields the highest validation accuracy on a target dataset. Our method achieves state-of-the-art accuracy on CIFAR-10, CIFAR-100, SVHN, and ImageNet (without additional data). On ImageNet, we attain a Top-1 accuracy of 83.5% which is 0.4% better than the previous record of 83.1%. On CIFAR-10, we achieve an error rate of 1.5%, which is 0.6% better than the previous state-of-the-art. Augmentation policies we find are  transferable between datasets.  The policy learned on ImageNet transfers well to achieve significant improvements on other datasets, such as Oxford Flowers, Caltech-101, Oxford-IIT Pets, FGVC Aircraft, and Stanford Cars.",http://openaccess.thecvf.com//www.cv-foundation.org/,"AutoAugment:,Learning,Augmentation,Strategies,From,Data"
12,SDRSAC: Semidefinite-Based Randomized Approach for Robust Point Cloud Registration Without Correspondences,"This paper presents a novel randomized algorithm for robust point cloud registration without correspondences. Most existing registration approaches require a set of putative correspondences obtained by extracting invariant descriptors. However, such descriptors could become unreliable in noisy and contaminated settings. In these settings, methods that directly handle input point sets are preferable.  Without correspondences, however,   conventional randomized techniques require a very large number of samples in order to reach satisfactory solutions. In this paper, we propose a novel approach to address this problem. In particular, our work enables the use of randomized methods for point cloud registration without the need of putative correspondences. By considering point cloud alignment as a special instance of graph matching and employing an efficient semi-definite relaxation, we propose a novel sampling mechanism, in which the size of the sampled subsets can be larger-than-minimal. Our tight relaxation scheme enables fast rejection of the outliers in the sampled sets, resulting in high quality hypotheses. We conduct extensive experiments to demonstrate that our approach outperforms other state-of-the-art methods. Importantly, our proposed method serves as a generic framework which can be extended to problems with known correspondences.",http://openaccess.thecvf.com//www.cv-foundation.org/,"SDRSAC:,Semidefinite-Based,Randomized,Approach,for,Robust,Point,Cloud,Registration,Without,Correspondences"
13,BAD SLAM: Bundle Adjusted Direct RGB-D SLAM,"A key component of Simultaneous Localization and Mapping (SLAM) systems is the joint optimization of the estimated 3D map and camera trajectory. Bundle adjustment (BA) is the gold standard for this. Due to the large number of variables in dense RGB-D SLAM, previous work has focused on approximating BA. In contrast, in this paper we present a novel, fast direct BA formulation which we implement in a real-time dense RGB-D SLAM algorithm. In addition, we show that direct RGB-D SLAM systems are highly sensitive to rolling shutter, RGB and depth sensor synchronization, and calibration errors. In order to facilitate state-of-the-art research on direct RGB-D SLAM, we propose a novel, well-calibrated benchmark for this task that uses synchronized global shutter RGB and depth cameras. It includes a training set, a test set without public ground truth, and an online evaluation service. We observe that the ranking of methods changes on this dataset compared to existing ones, and our proposed algorithm outperforms all other evaluated SLAM methods. Our benchmark and our open source SLAM algorithm are available at: www.eth3d.net",http://openaccess.thecvf.com//www.cv-foundation.org/,"BAD,SLAM:,Bundle,Adjusted,Direct,RGB-D,SLAM"
14,Revealing Scenes by Inverting Structure From Motion Reconstructions,"Many 3D vision systems localize cameras within a scene using 3D point clouds. Such point clouds are often obtained using structure from motion (SfM), after which the images are discarded to preserve privacy. In this paper, we show, for the first time, that such point clouds retain enough information to reveal scene appearance and compromise privacy. We present a privacy attack that reconstructs color images of the scene from the point cloud. Our method is based on a cascaded U-Net that takes as input, a 2D multichannel image of the points rendered from a specific viewpoint containing point depth and optionally color and SIFT descriptors and outputs a color image of the scene from that viewpoint. Unlike previous feature inversion methods, we deal with highly sparse and irregular 2D point distributions and inputs where many point attributes are missing, namely keypoint orientation and scale, the descriptor image source and the 3D point visibility. We evaluate our attack algorithm on public datasets and analyze the significance of the point cloud attributes. Finally, we show that novel views can also be generated thereby enabling compelling virtual tours of the underlying scene.",http://openaccess.thecvf.com//www.cv-foundation.org/,"Revealing,Scenes,by,Inverting,Structure,From,Motion,Reconstructions"
15,Strand-Accurate Multi-View Hair Capture,"Hair is one of the most challenging objects to reconstruct due to its micro-scale structure and a large number of repeated strands with heavy occlusions. In this paper, we present the first method to capture high-fidelity hair geometry with strand-level accuracy. Our method takes three stages to achieve this. In the first stage, a new multi-view stereo method with a slanted support line is proposed to solve the hair correspondences between different views. In detail, we contribute a novel cost function consisting of both photo-consistency term and geometric term that reconstructs each hair pixel as a 3D line. By merging all the depth maps, a point cloud, as well as local line directions for each point, is obtained. Thus, in the second stage, we feature a novel strand reconstruction method with the mean-shift to convert the noisy point data to a set of strands. Lastly, we grow the hair strands with multi-view geometric constraints to elongate the short strands and recover the missing strands, thus significantly increasing the reconstruction completeness. We evaluate our method on both synthetic data and real captured data, showing that our method can reconstruct hair strands with sub-millimeter accuracy.",http://openaccess.thecvf.com//www.cv-foundation.org/,"Strand-Accurate,Multi-View,Hair,Capture"
16,DeepSDF: Learning Continuous Signed Distance Functions for Shape Representation,"Computer graphics, 3D computer vision and robotics communities have produced multiple approaches to representing 3D geometry for rendering and reconstruction. These provide trade-offs across fidelity, efficiency and compression capabilities. In this work, we introduce DeepSDF, a learned continuous Signed Distance Function (SDF) representation of a class of shapes that enables high quality shape representation, interpolation and completion from partial and noisy 3D input data. DeepSDF, like its classical counterpart, represents a shape's surface by a continuous volumetric field: the magnitude of a point in the field represents the distance to the surface boundary and the sign indicates whether the region is inside (-) or outside (+) of the shape, hence our representation implicitly encodes a shape's boundary as the zero-level-set of the learned function while explicitly representing the classification of space as being part of the shapes interior or not. While classical SDF's both in analytical or discretized voxel form typically represent the surface of a single shape, DeepSDF can represent an entire class of shapes. Furthermore, we show state-of-the-art performance for learned 3D shape representation and completion while reducing the model size by an order of magnitude compared with previous work.",http://openaccess.thecvf.com//www.cv-foundation.org/,"DeepSDF:,Learning,Continuous,Signed,Distance,Functions,for,Shape,Representation"
17,Pushing the Boundaries of View Extrapolation With Multiplane Images,"We explore the problem of view synthesis from a narrow baseline pair of images, and focus on generating high-quality view extrapolations with plausible disocclusions. Our method builds upon prior work in predicting a multiplane image (MPI), which represents scene content as a set of RGBA planes within a reference view frustum and renders novel views by projecting this content into the target viewpoints. We present a theoretical analysis showing how the range of views that can be rendered from an MPI increases linearly with the MPI disparity sampling frequency, as well as a novel MPI prediction procedure that theoretically enables view extrapolations of up to 4 times the lateral viewpoint movement allowed by prior work. Our method ameliorates two specific issues that limit the range of views renderable by prior methods: 1) We expand the range of novel views that can be rendered without depth discretization artifacts by using a 3D convolutional network architecture along with a randomized-resolution training procedure to allow our model to predict MPIs with increased disparity sampling frequency. 2) We reduce the repeated texture artifacts seen in disocclusions by enforcing a constraint that the appearance of hidden content at any depth must be drawn from visible content at or behind that depth.",http://openaccess.thecvf.com//www.cv-foundation.org/,"Pushing,the,Boundaries,of,View,Extrapolation,With,Multiplane,Images"
