,0,1,2,3
108,Self-Supervised Learning of 3D Human Pose Using Multi-View Geometry,"Training accurate 3D human pose estimators requires large amount of 3D ground-truth data  which is costly to collect. Various weakly or self supervised pose estimation methods have been proposed due to lack of 3D data. Nevertheless, these methods, in addition to 2D ground-truth poses, require either additional supervision in various forms (e.g. unpaired 3D ground truth data, a small subset of labels) or the camera parameters in multiview settings. To address these problems, we present EpipolarPose, a self-supervised learning method for 3D human pose estimation, which does not need  any 3D ground-truth data or camera extrinsics. During training, EpipolarPose estimates 2D poses from multi-view images, and then, utilizes epipolar geometry to obtain a 3D pose and camera geometry which are subsequently used to train a 3D pose estimator. We demonstrate the effectiveness of our approach on standard benchmark datasets (i.e. Human3.6M and MPI-INF-3DHP) where we set the new state-of-the-art among weakly/self-supervised methods. Furthermore, we propose a new performance measure Pose Structure Score (PSS) which is a scale invariant, structure aware measure to evaluate the structural plausibility of a pose with respect to its ground truth. Code and pretrained models are available at https://github.com/mkocabas/EpipolarPose",http://openaccess.thecvf.com//www.cv-foundation.org/,"Self-Supervised,Learning,of,3D,Human,Pose,Using,Multi-View,Geometry"
109,FSA-Net: Learning Fine-Grained Structure Aggregation for Head Pose Estimation From a Single Image,"This paper proposes a method for head pose estimation from a single image. Previous methods often predict head poses through landmark or depth estimation and would require more computation than necessary. Our method is based on regression and feature aggregation. For having a compact model, we employ the soft stagewise regression scheme. Existing feature aggregation methods treat inputs as a bag of features and thus ignore their spatial relationship in a feature map. We propose to learn a fine-grained structure mapping for spatially grouping features before aggregation. The fine-grained structure provides part-based information and pooled values. By utilizing learnable and non-learnable importance over the spatial location, different model variants can be generated and form a complementary ensemble. Experiments show that our method outperforms the state-of-the-art methods including both the landmark-free ones and the ones based on landmark or depth estimation. With only a single RGB frame as input, our method even outperforms methods utilizing multi-modality information (RGB-D, RGB-Time) on estimating the yaw angle. Furthermore, the memory overhead of our model is 100 times smaller than those of previous methods.",http://openaccess.thecvf.com//www.cv-foundation.org/,"FSA-Net:,Learning,Fine-Grained,Structure,Aggregation,for,Head,Pose,Estimation,From,a,Single,Image"
110,Dense 3D Face Decoding Over 2500FPS: Joint Texture & Shape Convolutional Mesh Decoders,"3D Morphable Models (3DMMs) are statistical models that represent facial texture and shape variations using a set of linear bases and more particular Principal Component Analysis (PCA). 3DMMs were used as statistical priors for reconstructing 3D faces from images by solving non-linear least square optimization problems. Recently, 3DMMs were used as generative models for training non-linear mappings (i.e., regressors) from image to the parameters of the models via Deep Convolutional Neural Networks (DCNNs). Nevertheless, all of the above methods use either fully connected layers or 2D convolutions on parametric unwrapped UV spaces leading to large networks with many parameters. In this paper, we present the first, to the best of our knowledge, non-linear 3DMMs by learning joint texture and shape auto-encoders using direct mesh convolutions. We demonstrate how these auto-encoders can be used to train very light-weight models that perform Coloured Mesh Decoding (CMD) in-the-wild at a speed of over 2500 FPS.",http://openaccess.thecvf.com//www.cv-foundation.org/,"Dense,3D,Face,Decoding,Over,2500FPS:,Joint,Texture,&,Shape,Convolutional,Mesh,Decoders"
111,Does Learning Specific Features for Related Parts Help Human Pose Estimation?,"Human pose estimation (HPE) is inherently a homogeneous multi-task learning problem, with the localization of each body part as a different task. Recent HPE approaches universally learn a shared representation for all parts, from which their locations are linearly regressed. However, our statistical analysis indicates not all parts are related to each other. As a result, such a sharing mechanism can lead to negative transfer and deteriorate the performance. This potential issue drives us to raise an interesting question.  Can we identify related parts and learn specific features for them to improve pose estimation? Since unrelated tasks no longer share a high-level representation, we expect to avoid the adverse effect of negative transfer.  In addition, more explicit structural knowledge, e.g., ankles and knees are highly related, is incorporated into the model, which helps resolve ambiguities in HPE. To answer this question, we first propose a data-driven approach to group related parts based on how much information they share. Then a part-based branching network (PBN) is introduced to learn representations specific to each part group. We further present a multi-stage version of this network to repeatedly refine intermediate features and pose estimates. Ablation experiments indicate learning specific features significantly improves the localization of occluded parts and thus benefits HPE. Our approach also outperforms all state-of-the-art methods on two benchmark datasets, with an outstanding advantage when occlusion occurs.",http://openaccess.thecvf.com//www.cv-foundation.org/,"Does,Learning,Specific,Features,for,Related,Parts,Help,Human,Pose,Estimation?"
112,Linkage Based Face Clustering via Graph Convolution Network,"In this paper, we present an accurate and scalable approach to the face clustering task. We aim at grouping a set of faces by their potential identities. We formulate this task as a link prediction problem: a link exists between two faces if they are of the same identity. The key idea is that we find the local context in the feature space around an instance (face) contains rich information about the linkage relationship between this instance and its neighbors. By constructing sub-graphs around each instance as input data, which depict the local context, we utilize the graph convolution network (GCN) to perform reasoning and infer the likelihood of linkage between pairs in the sub-graphs. Experiments show that our method is more robust to the complex distribution of faces than conventional methods, yielding favorably comparable results to state-of-the-art methods on standard face clustering benchmarks, and is scalable to large datasets. Furthermore, we show that the proposed method does not need the number of clusters as prior, is aware of noises and outliers, and can be extended to a multi-view version for more accurate clustering accuracy.",http://openaccess.thecvf.com//www.cv-foundation.org/,"Linkage,Based,Face,Clustering,via,Graph,Convolution,Network"
113,Towards High-Fidelity Nonlinear 3D Face Morphable Model,"Embedding 3D morphable basis functions into deep neural networks opens great potential for models with better representation power. However, to faithfully learn those models from an image collection, it requires strong regularization to overcome ambiguities involved in the learning process. This critically prevents us from learning high fidelity face models which are needed to represent face images in high level of details. To address this problem, this paper presents a novel approach to learn additional proxies as means to side-step strong regularizations, as well as, leverages to promote detailed shape/albedo. To ease the learning, we also propose to use a dual-pathway network, a carefully-designed architecture that brings a balance between global and local-based models. By improving the nonlinear 3D morphable model in both learning objective and network architecture, we present a model which is superior in capturing higher level of details than the linear or its precedent nonlinear counterparts. As a result, our model achieves state-of-the-art performance on 3D face reconstruction by solely optimizing latent representations.",http://openaccess.thecvf.com//www.cv-foundation.org/,"Towards,High-Fidelity,Nonlinear,3D,Face,Morphable,Model"
114,RegularFace: Deep Face Recognition via Exclusive Regularization,"We consider the face recognition task where facial images of the same identity (person) is expected to be closer in the representation space, while different identities be far apart. Several recent studies encourage the intra-class compactness by developing loss functions that penalize the variance of representations of the same identity. In this paper, we propose the `exclusive regularization'  that focuses on the other aspect of discriminability --  the inter-class separability,  which is neglected in many recent approaches. The proposed method, named RegularFace, explicitly distances identities by penalizing the angle between an identity and its nearest neighbor, resulting in discriminative face representations. Our method has intuitive geometric interpretation and presents unique benefits that are absent in previous works. Quantitative comparisons against prior methods on several open benchmarks demonstrate the superiority of our method. In addition, our method is easy to implement and requires only a few lines of python code on modern deep learning frameworks.",http://openaccess.thecvf.com//www.cv-foundation.org/,"RegularFace:,Deep,Face,Recognition,via,Exclusive,Regularization"
115,BridgeNet: A Continuity-Aware Probabilistic Network for Age Estimation,"Age estimation is an important yet very challenging problem in computer vision. Existing methods for age estimation usually apply a divide-and-conquer strategy to deal with heterogeneous data caused by the non-stationary aging process. However, the facial aging process is also a continuous process, and the continuity relationship between different components has not been effectively exploited. In this paper, we propose BridgeNet for age estimation, which aims to mine the continuous relation between age labels effectively. The proposed BridgeNet consists of local regressors and gating networks. Local regressors partition the data space into multiple overlapping subspaces to tackle heterogeneous data and gating networks learn continuity aware weights for the results of local regressors by employing the proposed bridge-tree structure, which introduces bridge connections into tree models to enforce the similarity between neighbor nodes. Moreover, these two components of BridgeNet can be jointly learned in an end-to-end way. We show experimental results on the MORPH II, FG-NET and Chalearn LAP 2015 datasets and find that BridgeNet outperforms the state-of-the-art methods.",http://openaccess.thecvf.com//www.cv-foundation.org/,"BridgeNet:,A,Continuity-Aware,Probabilistic,Network,for,Age,Estimation"
116,GANFIT: Generative Adversarial Network Fitting for High Fidelity 3D Face Reconstruction,"In the past few years, a lot of work has been done towards reconstructing the 3D facial structure from single images by capitalizing on the power of Deep Convolutional Neural Networks (DCNNs). In the most recent works, differentiable renderers were employed in order to learn the relationship between the facial identity features and the parameters of a 3D morphable model for shape and texture. The texture features either correspond to components of a linear texture space or are learned by auto-encoders directly from in-the-wild images. In all cases, the quality of the facial texture reconstruction of the state-of-the-art methods is still not capable of modeling textures in high fidelity. In this paper, we take a radically different approach and harness the power of Generative Adversarial Networks (GANs) and DCNNs in order to reconstruct the facial texture and shape from single images. That is, we utilize GANs to train a very powerful generator of facial texture in UV space. Then, we revisit the original 3D Morphable Models (3DMMs) fitting approaches making use of non-linear optimization to find the optimal latent parameters that best reconstruct the test image but under a new perspective. We optimize the parameters with the supervision of pretrained deep identity features through our end-to-end differentiable framework. We demonstrate excellent results in photorealistic and identity preserving 3D face reconstructions and achieve for the first time, to the best of our knowledge, facial texture reconstruction with high-frequency details.",http://openaccess.thecvf.com//www.cv-foundation.org/,"GANFIT:,Generative,Adversarial,Network,Fitting,for,High,Fidelity,3D,Face,Reconstruction"
117,Improving the Performance of Unimodal Dynamic Hand-Gesture Recognition With Multimodal Training,"We present an efficient approach for leveraging the knowledge from multiple modalities in training unimodal 3D convolutional neural networks (3D-CNNs) for the task of dynamic hand gesture recognition.   Instead of explicitly combining multimodal information, which is commonplace in many state-of-the-art methods, we propose a different framework in which we embed the knowledge of multiple modalities in individual networks so that each unimodal network can achieve an improved performance.  In particular, we dedicate separate networks per available modality and enforce them to collaborate and learn to develop networks with common semantics and better representations.  We introduce a ""spatiotemporal semantic alignment"" loss (SSA) to align the content of the features from different networks.  In addition, we regularize this loss with our proposed ""focal regularization parameter"" to avoid negative knowledge transfer.   Experimental results show that our framework improves the test time recognition accuracy of unimodal networks, and provides the state-of-the-art performance on various dynamic hand gesture recognition datasets.",http://openaccess.thecvf.com//www.cv-foundation.org/,"Improving,the,Performance,of,Unimodal,Dynamic,Hand-Gesture,Recognition,With,Multimodal,Training"
118,Learning to Reconstruct People in Clothing From a Single RGB Camera,"We present Octopus, a learning-based model to infer the personalized 3D shape of people from a few frames (1-8) of a monocular video in which the person is moving with a reconstruction accuracy of 4 to 5mm, while being orders of magnitude faster than previous methods. From semantic segmentation images, our Octopus model reconstructs a 3D shape, including the parameters of SMPL plus clothing and hair in 10 seconds or less.  The model achieves fast and accurate predictions based on two key design choices. First, by predicting shape in a canonical T-pose space, the network learns to encode the images of the person into pose-invariant latent codes, where the information is fused. Second, based on the observation that feed-forward predictions are fast but do not always align with the input images, we predict using both, bottom-up and top-down streams (one per view) allowing information to flow in both directions. Learning relies only on synthetic 3D data. Once learned, Octopus can take a variable number of frames as input, and is able to reconstruct shapes even from a single image with an accuracy of 5mm. Results on 3 different datasets demonstrate the efficacy and accuracy of our approach.",http://openaccess.thecvf.com//www.cv-foundation.org/,"Learning,to,Reconstruct,People,in,Clothing,From,a,Single,RGB,Camera"
119,Distilled Person Re-Identification: Towards a More Scalable System,"Person re-identification (Re-ID), for matching pedestrians across non-overlapping camera views, has made great progress in supervised learning with abundant labelled data. However, the scalability problem is the bottleneck for applications in large-scale systems. We consider the scalability problem of Re-ID from three aspects: (1) low labelling cost by reducing label amount, (2) low extension cost by reusing existing knowledge and (3) low testing computation cost by using lightweight models. The requirements render scalable Re-ID a challenging problem. To solve these problems in a unified system, we propose a Multi-teacher Adaptive Similarity Distillation Framework, which requires only a few labelled identities of target domain to transfer knowledge from multiple teacher models to a user-specified lightweight student model without accessing source domain data. We propose the Log-Euclidean Similarity Distillation Loss for Re-ID and further integrate the Adaptive Knowledge Aggregator to select effective teacher models to transfer target-adaptive knowledge. Extensive evaluations show that our method can extend with high scalability and the performance is comparable to the state-of-the-art unsupervised and semi-supervised Re-ID methods.",http://openaccess.thecvf.com//www.cv-foundation.org/,"Distilled,Person,Re-Identification:,Towards,a,More,Scalable,System"
120,A Perceptual Prediction Framework for Self Supervised Event Segmentation,"Temporal segmentation of long videos is an important problem, that has largely been tackled through supervised learning, often requiring large amounts of annotated training data. In this paper, we tackle the problem of self-supervised temporal segmentation that alleviates the need for any supervision in the form of labels (full supervision) or temporal ordering (weak supervision). We introduce a self-supervised, predictive learning framework that draws inspiration from cognitive psychology to segment long, visually complex videos into constituent events. Learning involves only a single pass through the training data. We also introduce a new adaptive learning paradigm that helps reduce the effect of catastrophic forgetting in recurrent neural networks. Extensive experiments on three publicly available datasets - Breakfast Actions, 50 Salads, and INRIA Instructional Videos datasets show the efficacy of the proposed approach.  We show that the proposed approach outperforms weakly-supervised and unsupervised baselines by up to 24% and achieves competitive segmentation results compared to fully supervised baselines with only a single pass through the training data. Finally, we show that the proposed self-supervised learning paradigm learns highly discriminating features to improve action recognition.",http://openaccess.thecvf.com//www.cv-foundation.org/,"A,Perceptual,Prediction,Framework,for,Self,Supervised,Event,Segmentation"
121,COIN: A Large-Scale Dataset for Comprehensive Instructional Video Analysis,"There are substantial instruction videos on the Internet, which enables us to acquire knowledge for completing various tasks. However, most existing datasets for instruction video analysis have the limitations in diversity and scale, which makes them far from many real-world applications where more diverse activities occur. Moreover, it still remains a great challenge to organize and harness such data. To address these problems, we introduce a large-scale dataset called ""COIN"" for COmprehensive INstruction video analysis. Organized with a hierarchical structure, the COIN dataset contains 11,827 videos of 180 tasks in 12 domains (e.g., vehicles, gadgets, etc.) related to our daily life. With a new developed toolbox, all the videos are annotated effectively with a series of step descriptions and the corresponding temporal boundaries. Furthermore, we propose a simple yet effective method to capture the dependencies among different steps, which can be easily plugged into conventional proposal-based action detection methods for localizing important steps in instruction videos. In order to provide a benchmark for instruction video analysis, we evaluate plenty of approaches on the COIN dataset under different evaluation criteria. We expect the introduction of the COIN dataset will promote the future in-depth research on instruction video analysis for the community.",http://openaccess.thecvf.com//www.cv-foundation.org/,"COIN:,A,Large-Scale,Dataset,for,Comprehensive,Instructional,Video,Analysis"
122,Recurrent Attentive Zooming for Joint Crowd Counting and Precise Localization,"Crowd counting is a new frontier in computer vision with far-reaching applications particularly in social safety management. A majority of existing works adopt a methodology that first estimates a person-density map and then calculates integral over this map to obtain the final count. As noticed by several prior investigations, the learned density map can significantly deviate from the true person density even though the final reported count is precise. This implies that the density map is unreliable for localizing crowd. To address this issue, this work proposes a novel framework that simultaneously solving two inherently related tasks - crowd counting and localization. The contributions are several-fold. First, our formulation is based on a crucial observation that localization tends to be inaccurate at high-density regions, and increasing the resolution is an effective albeit simple solution for improving localization. We thus propose Recurrent Attentive Zooming Network, which recurrently detects ambiguous image region and zooms it into high resolution for re-inspection. Second, the two tasks of counting and localization mutually reinforce each other. We propose an adaptive fusion scheme that effectively elevates the performance. Finally, a well-defined evaluation metric is proposed for the rarely-explored localization task. We conduct comprehensive evaluations on several crowd benchmarks, including the newly-developed large-scale UCF-QNRF dataset and demonstrate superior advantages over state-of-the-art methods.",http://openaccess.thecvf.com//www.cv-foundation.org/,"Recurrent,Attentive,Zooming,for,Joint,Crowd,Counting,and,Precise,Localization"
123,An Attention Enhanced Graph Convolutional LSTM Network for Skeleton-Based Action Recognition,"Skeleton-based action recognition is an important task that requires the adequate understanding of movement characteristics of a human action from the given skeleton sequence. Recent studies have shown that exploring spatial and temporal features of the skeleton sequence is vital for this task. Nevertheless, how to effectively extract discriminative spatial and temporal features is still a challenging problem. In this paper, we propose a novel Attention Enhanced Graph Convolutional LSTM Network (AGC-LSTM) for human action recognition from skeleton data. The proposed AGC-LSTM can not only capture discriminative features in spatial configuration and temporal dynamics but also explore the co-occurrence relationship between spatial and temporal domains. We also present a temporal hierarchical architecture to increase temporal receptive fields of the top AGC-LSTM layer, which boosts the ability to learn the high-level semantic representation and significantly reduces the computation cost. Furthermore, to select discriminative spatial information, the attention mechanism is employed to enhance information of key joints in each AGC-LSTM layer. Experimental results on two datasets are provided: NTU RGB+D dataset and Northwestern-UCLA dataset. The comparison results demonstrate the effectiveness of our approach and show that our approach outperforms the state-of-the-art methods on both datasets.",http://openaccess.thecvf.com//www.cv-foundation.org/,"An,Attention,Enhanced,Graph,Convolutional,LSTM,Network,for,Skeleton-Based,Action,Recognition"
124,Graph Convolutional Label Noise Cleaner: Train a Plug-And-Play Action Classifier for Anomaly Detection,"Video anomaly detection under weak labels is formulated as a typical multiple-instance learning problem in previous works. In this paper, we provide a new perspective, i.e., a supervised learning task under noisy labels. In such a viewpoint, as long as cleaning away label noise, we can directly apply fully supervised action classifiers to weakly supervised anomaly detection, and take maximum advantage of these well-developed classifiers. For this purpose, we devise a graph convolutional network to correct noisy labels. Based upon feature similarity and temporal consistency, our network propagates supervisory signals from high-confidence snippets to low-confidence ones. In this manner, the network is capable of providing cleaned supervision for action classifiers. During the test phase, we only need to obtain snippet-wise predictions from the action classifier without any extra post-processing. Extensive experiments on 3 datasets at different scales with 2 types of action classifiers demonstrate the efficacy of our method. Remarkably, we obtain the frame-level AUC score of 82.12% on UCF-Crime.",http://openaccess.thecvf.com//www.cv-foundation.org/,"Graph,Convolutional,Label,Noise,Cleaner:,Train,a,Plug-And-Play,Action,Classifier,for,Anomaly,Detection"
