,0,1,2,3
217,Learning Context Graph for Person Search,"Person re-identification has achieved great progress with deep convolutional neural networks. However, most previous methods focus on learning individual appearance feature embedding, and it is hard for the models to handle difficult situations with different illumination, large pose variance and occlusion. In this work, we take a step further and consider employing context information for person search. For a probe-gallery pair, we first propose a contextual instance expansion module, which employs a relative attention module to search and filter useful context information in the scene. We also build a graph learning framework to effectively employ context pairs to update target similarity. These two modules are built on top of a joint detection and instance feature learning framework, which improves the discriminativeness of the learned features. The proposed framework achieves state-of-the-art performance on two widely used person search datasets.",http://openaccess.thecvf.com//www.cv-foundation.org/,"Learning,Context,Graph,for,Person,Search"
218,Gradient Matching Generative Networks for Zero-Shot Learning,"Zero-shot learning (ZSL) is one of the most promising problems where substantial progress can potentially be achieved through unsupervised learning, due to distributional differences between supervised and zero-shot classes. For this reason, several works investigate the incorporation of discriminative domain adaptation techniques into ZSL, which, however, lead to modest improvements in ZSL accuracy. In contrast, we propose a generative model that can naturally learn from unsupervised examples, and synthesize training examples for unseen classes purely based on their class embeddings, and therefore, reduce the zero-shot learning problem into a supervised classification task. The proposed approach consists of two important components: (i) a conditional Generative Adversarial Network that learns to produce samples that mimic the characteristics of unsupervised data examples, and (ii) the Gradient Matching (GM) loss that measures the quality of the gradient signal obtained from the synthesized examples. Using our GM loss formulation, we enforce the generator to produce examples from which accurate classifiers can be trained. Experimental results on several ZSL benchmark datasets show that our approach leads to significant improvements over the state of the art in generalized zero-shot classification.",http://openaccess.thecvf.com//www.cv-foundation.org/,"Gradient,Matching,Generative,Networks,for,Zero-Shot,Learning"
219,Doodle to Search: Practical Zero-Shot Sketch-Based Image Retrieval,"In this paper, we investigate the problem of zero-shot sketch-based image retrieval (ZS-SBIR), where human sketches are used as queries to conduct retrieval of photos from unseen categories. We importantly advance prior arts by proposing a novel ZS-SBIR scenario that represents a firm step forward in its practical application. The new setting uniquely recognizes two important yet often neglected challenges of practical ZS-SBIR, (i) the large domain gap between amateur sketch and photo, and (ii) the necessity for moving towards large-scale retrieval. We first contribute to the community a novel ZS-SBIR dataset, QuickDraw-Extended, that consists of 330,000 sketches and 204,000 photos spanning across 110 categories. Highly abstract amateur human sketches are purposefully sourced to maximize the domain gap, instead of ones included in existing datasets that can often be semi-photorealistic. We then formulate a ZS-SBIR framework to jointly model sketches and photos into a common embedding space. A novel strategy to mine the mutual information among domains is specifically engineered to alleviate the domain gap. External semantic knowledge is further embedded to aid semantic transfer. We show that, rather surprisingly, retrieval performance significantly outperforms that of state-of-the-art on existing datasets that can already be achieved using a reduced version of our model. We further demonstrate the superior performance of our full model by comparing with a number of alternatives on the newly proposed dataset. The new dataset, plus all training and testing code of our model, will be publicly released to facilitate future research.",http://openaccess.thecvf.com//www.cv-foundation.org/,"Doodle,to,Search:,Practical,Zero-Shot,Sketch-Based,Image,Retrieval"
220,Zero-Shot Task Transfer,"In this work, we present a novel meta-learning algorithm that regresses model parameters for novel tasks for which no ground truth is available (zero-shot tasks). In order to adapt to novel zero-shot tasks, our meta-learner learns from the model parameters of known tasks (with ground truth) and the correlation of known tasks to zero-shot tasks. Such intuition finds its foothold in cognitive science, where a subject (human baby) can adapt to a novel concept (depth understanding) by correlating it with old concepts (hand movement or self-motion), without receiving an explicit supervision. We evaluated our model on the Taskonomy dataset, with four tasks as zero-shot: surface normal, room layout, depth and camera pose estimation. These tasks were chosen based on the data acquisition complexity and the complexity associated with the learning process using a deep network. Our proposed methodolgy outperforms state-of-the-art models (which use ground truth) on each of our zero-shot tasks, showing promise on zero-shot task transfer. We also conducted extensive experiments to study the various choices of our methodology, as well as showed how the proposed method can also be used in transfer learning. To the best of our knowledge, this is the first such effort on zero-shot learning in the task space.",http://openaccess.thecvf.com//www.cv-foundation.org/,"Zero-Shot,Task,Transfer"
221,C-MIL: Continuation Multiple Instance Learning for Weakly Supervised Object Detection,"Weakly supervised object detection (WSOD) is a challenging task when provided with image category supervision but required to simultaneously learn object locations and object detectors. Many WSOD approaches adopt multiple instance learning (MIL) and have non-convex loss functions which are prone to get stuck into local minima (falsely localize object parts) while missing full object extent during training. In this paper, we introduce a continuation optimization method into MIL and thereby creating continuation multiple instance learning (C-MIL), with the intention of alleviating the non-convexity problem in a systematic way. We partition instances into spatially related and class related subsets, and approximate the original loss function with a series of smoothed loss functions defined within the subsets. Optimizing smoothed loss functions prevents the training procedure falling prematurely into local minima and facilitates the discovery of Stable Semantic Extremal Regions (SSERs) which indicate full object extent. On the PASCAL VOC 2007 and 2012 datasets, C-MIL improves the state-of-the-art of weakly supervised object detection and weakly supervised object localization with large margins.",http://openaccess.thecvf.com//www.cv-foundation.org/,"C-MIL:,Continuation,Multiple,Instance,Learning,for,Weakly,Supervised,Object,Detection"
222,Weakly Supervised Learning of Instance Segmentation With Inter-Pixel Relations,"This paper presents a novel approach for learning instance segmentation with image-level class labels as supervision. Our approach generates pseudo instance segmentation labels of training images, which are used to train a fully supervised model. For generating the pseudo labels, we first identify confident seed areas of object classes from attention maps of an image classification model, and propagate them to discover the entire instance areas with accurate boundaries. To this end, we propose IRNet, which estimates rough areas of individual instances and detects boundaries between different object classes. It thus enables to assign instance labels to the seeds and to propagate them within the boundaries so that the entire areas of instances can be estimated accurately. Furthermore, IRNet is trained with inter-pixel relations on the attention maps, thus no extra supervision is required. Our method with IRNet achieves an outstanding performance on the PASCAL VOC 2012 dataset, surpassing not only previous state-of-the-art trained with the same level of supervision, but also some of previous models relying on stronger supervision.",http://openaccess.thecvf.com//www.cv-foundation.org/,"Weakly,Supervised,Learning,of,Instance,Segmentation,With,Inter-Pixel,Relations"
223,Attention-Based Dropout Layer for Weakly Supervised Object Localization,"Weakly Supervised Object Localization (WSOL) techniques learn the object location only using image-level labels, without location annotations. A common limitation for these techniques is that they cover only the most discriminative part of the object, not the entire object. To address this problem, we propose an Attention-based Dropout Layer (ADL), which utilizes the self-attention mechanism to process the feature maps of the model. The proposed method is composed of two key components: 1) hiding the most discriminative part from the model for capturing the integral extent of object, and 2) highlighting the informative region for improving the recognition power of the model. Based on extensive experiments, we demonstrate that the proposed method is effective to improve the accuracy of WSOL, achieving a new state-of-the-art localization accuracy in CUB-200-2011 dataset. We also show that the proposed method is much more efficient in terms of both parameter and computation overheads than existing techniques.",http://openaccess.thecvf.com//www.cv-foundation.org/,"Attention-Based,Dropout,Layer,for,Weakly,Supervised,Object,Localization"
224,Domain Generalization by Solving Jigsaw Puzzles,"Human adaptability relies crucially on the ability to learn and merge knowledge both from supervised and unsupervised learning: the parents point out few important concepts, but then the children fill in the gaps on their own. This is particularly effective, because supervised learning can never be exhaustive and thus learning autonomously allows to discover invariances and regularities that help to generalize. In this paper we propose to apply a similar approach to the task of object recognition across domains: our model learns the semantic labels in a supervised fashion, and broadens its understanding of the data by learning from self-supervised signals how to solve a jigsaw puzzle on the same images. This secondary task helps the network to learn the concepts of spatial correlation while acting as a regularizer for the classification task. Multiple experiments on the PACS, VLCS, Office-Home and digits datasets confirm our intuition and show that this simple method  outperforms previous domain generalization and adaptation solutions. An ablation study further illustrates the inner workings of our approach.",http://openaccess.thecvf.com//www.cv-foundation.org/,"Domain,Generalization,by,Solving,Jigsaw,Puzzles"
225,Transferrable Prototypical Networks for Unsupervised Domain Adaptation,"In this paper, we introduce a new idea for unsupervised domain adaptation via a remold of Prototypical Networks, which learn an embedding space and perform classification via a remold of the distances to the prototype of each class. Specifically, we present Transferrable Prototypical Networks (TPN) for adaptation such that the prototypes for each class in source and target domains are close in the embedding space and the score distributions predicted by prototypes separately on source and target data are similar. Technically, TPN initially matches each target example to the nearest prototype in the source domain and assigns an example a ""pseudo"" label. The prototype of each class could then be computed on source-only, target-only and source-target data, respectively. The optimization of TPN is end-to-end trained by jointly minimizing the distance across the prototypes on three types of data and KL-divergence of score distributions output by each pair of the prototypes. Extensive experiments are conducted on the transfers across MNIST, USPS and SVHN datasets, and superior results are reported when comparing to state-of-the-art approaches. More remarkably, we obtain an accuracy of 80.4% of single model on VisDA 2017 dataset.",http://openaccess.thecvf.com//www.cv-foundation.org/,"Transferrable,Prototypical,Networks,for,Unsupervised,Domain,Adaptation"
226,Blending-Target Domain Adaptation by Adversarial Meta-Adaptation Networks,"(Unsupervised) Domain Adaptation (DA) seeks for classifying target instances when solely provided with source labeled and target unlabeled examples for training. Learning domain-invariant features helps to achieve this goal, whereas it underpins unlabeled samples drawn from a single or multiple explicit target domains (Multi-target DA). In this paper, we consider a more realistic transfer scenario: our target domain is comprised of multiple sub-targets implicitly blended with each other so that learners could not identify which sub-target each unlabeled sample belongs to. This Blending-target Domain Adaptation (BTDA) scenario commonly appears in practice and threatens the validities of existing DA algorithms, due to the presence of domain gaps and categorical misalignments among these hidden sub-targets.   To reap the transfer performance gains in this new scenario, we propose Adversarial Meta-Adaptation Network (AMEAN). AMEAN entails two adversarial transfer learning processes. The first is a conventional adversarial transfer to bridge our source and mixed target domains. To circumvent the intra-target category misalignment, the second process presents as ""learning to adapt"": It deploys an unsupervised meta-learner receiving target data and their ongoing feature-learning feedbacks, to discover target clusters as our ""meta-sub-target"" domains. This meta-sub-targets auto-design our meta-sub-target adaptation loss, which is capable to progressively eliminate the implicit category mismatching in our mixed target. We evaluate AMEAN and a variety of DA algorithms in three benchmarks under the BTDA setup. Empirical results show that BTDA is a quite challenging transfer setup for most existing DA algorithms, yet AMEAN significantly outperforms these state-of-the-art baselines and effectively restrains the negative transfer effects in BTDA.",http://openaccess.thecvf.com//www.cv-foundation.org/,"Blending-Target,Domain,Adaptation,by,Adversarial,Meta-Adaptation,Networks"
227,ELASTIC: Improving CNNs With Dynamic Scaling Policies,"Scale variation has been a challenge from traditional to modern approaches in computer vision. Most solutions to scale issues have a similar theme: a set of intuitive and manually designed policies that are generic and fixed (e.g. SIFT or feature pyramid). We argue that the scaling policy should be learned from data. In this paper, we introduce Elastic, a simple, efficient and yet very effective approach to learn a dynamic scale policy from data. We formulate the scaling policy as a non-linear function inside the network's structure that (a) is learned from data, (b) is instance specific, (c) does not add extra computation, and (d) can be applied on any network architecture.  We applied Elastic to several state-of-the-art network architectures and showed consistent improvement without extra (sometimes even lower) computation on ImageNet classification, MSCOCO multi-label classification, and PASCAL VOC semantic segmentation. Our results show major improvement for images with scale challenges. Our code is available here: https://github.com/allenai/elastic",http://openaccess.thecvf.com//www.cv-foundation.org/,"ELASTIC:,Improving,CNNs,With,Dynamic,Scaling,Policies"
228,ScratchDet: Training Single-Shot Object Detectors From Scratch,"Current state-of-the-art object objectors are fine-tuned from the off-the-shelf networks pretrained on large-scale classification dataset ImageNet, which incurs some additional problems: 1) The classification and detection have different degrees of sensitivity to translation, resulting in the learning objective bias; 2) The architecture is limited by the classification network, leading to the inconvenience of modification. To cope with these problems, training detectors from scratch is a feasible solution. However, the detectors trained from scratch generally perform worse than the pretrained ones, even suffer from the convergence issue in training. In this paper, we explore to train object detectors from scratch robustly. By analysing the previous work on optimization landscape, we find that one of the overlooked points in current trained-from-scratch detector is the BatchNorm. Resorting to the stable and predictable gradient brought by BatchNorm, detectors can be trained from scratch stably while keeping the favourable performance independent to the network architecture. Taking this advantage, we are able to explore various types of networks for object detection, without suffering from the poor convergence. By extensive experiments and analyses on downsampling factor, we propose the Root-ResNet backbone network, which makes full use of the information from original images. Our ScratchDet achieves the state-of-the-art accuracy on PASCAL VOC 2007, 2012 and MS COCO among all the train-from-scratch detectors and even performs better than several one-stage pretrained methods. Codes will be made publicly available at https://github.com/KimSoybean/ScratchDet.",http://openaccess.thecvf.com//www.cv-foundation.org/,"ScratchDet:,Training,Single-Shot,Object,Detectors,From,Scratch"
229,SFNet: Learning Object-Aware Semantic Correspondence,"We address the problem of semantic correspondence, that is, establishing a dense flow field between images depicting different instances of the same object or scene category. We propose to use images annotated with binary foreground masks and subjected to synthetic geometric deformations to train a convolutional neural network (CNN) for this task. Using these masks as part of the supervisory signal offers a good compromise between semantic flow methods, where the amount of training data is limited by the cost of manually selecting point correspondences, and semantic alignment ones, where the regression of a single global geometric transformation between images may be sensitive to image-specific details such as background clutter. We propose a new CNN architecture, dubbed SFNet, which implements this idea. It leverages a new and differentiable version of the argmax function for end-to-end training, with a loss that combines mask and flow consistency with smoothness terms. Experimental results demonstrate the effectiveness of our approach, which significantly outperforms the state of the art on standard benchmarks.",http://openaccess.thecvf.com//www.cv-foundation.org/,"SFNet:,Learning,Object-Aware,Semantic,Correspondence"
230,Deep Metric Learning Beyond Binary Supervision,"Metric Learning for visual similarity has mostly adopted binary supervision indicating whether a pair of images are of the same class or not. Such a binary indicator covers only a limited subset of image relations, and is not sufficient to represent semantic similarity between images described by continuous and/or structured labels such as object poses, image captions, and scene graphs. Motivated by this, we present a novel method for deep metric learning using continuous labels. First, we propose a new triplet loss that allows distance ratios in the label space to be preserved in the learned metric space. The proposed loss thus enables our model to learn the degree of similarity rather than just the order. Furthermore, we design a triplet mining strategy adapted to metric learning with continuous labels. We address three different image retrieval tasks with continuous labels in terms of human poses, room layouts and image captions, and demonstrate the superior performance of our approach compared to previous methods.",http://openaccess.thecvf.com//www.cv-foundation.org/,"Deep,Metric,Learning,Beyond,Binary,Supervision"
231,Learning to Cluster Faces on an Affinity Graph,"Face recognition sees remarkable progress in recent years, and its performance has reached a very high level. Taking it to a next level requires substantially larger data, which would involve prohibitive annotation cost. Hence, exploiting unlabeled data becomes an appealing alternative. Recent works have shown that clustering unlabeled faces is a promising approach, often leading to notable performance gains. Yet, how to effectively cluster, especially on a large-scale (i.e. million-level or above) dataset, remains an open question. A key challenge lies in the complex variations of cluster patterns, which make it difficult for conventional clustering methods to meet the needed accuracy. This work explores a novel approach, namely, learning to cluster instead of relying on hand-crafted criteria. Specifically, we propose a framework based on graph convolutional network, which combines a detection and a segmentation module to pinpoint face clusters. Experiments show that our method yields significantly more accurate face clusters, which, as a result, also lead to further performance gain in face recognition.",http://openaccess.thecvf.com//www.cv-foundation.org/,"Learning,to,Cluster,Faces,on,an,Affinity,Graph"
232,C2AE: Class Conditioned Auto-Encoder for Open-Set Recognition,"Models trained for classification often assume that all testing classes are known while training. As a result, when presented with an unknown class during testing, such closed-set assumption forces the model to classify it as one of the known classes. However, in a real world scenario, classification models are likely to encounter such examples. Hence, identifying those examples as unknown becomes critical to model performance. A potential solution to overcome this problem lies in a class of learning problems known as open-set recognition. It refers to the problem of identifying the unknown classes during testing, while maintaining performance on the known classes. In this paper, we propose an open-set recognition algorithm using class conditioned auto-encoders with novel training and testing methodologies. In this method, training procedure is divided in two sub-tasks, 1. closed-set classification and, 2. open-set identification (i.e. identifying a class as known or unknown). Encoder learns the first task following the closed-set classification training pipeline, whereas decoder learns the second task by reconstructing conditioned on class identity. Furthermore, we model reconstruction errors using the Extreme Value Theory of statistical modeling to find the threshold for identifying known/unknown class samples. Experiments performed on multiple image classification datasets show that the proposed method performs significantly better than the state of the art methods. The source code is available at: github.com/otkupjnoz/c2ae.",http://openaccess.thecvf.com//www.cv-foundation.org/,"C2AE:,Class,Conditioned,Auto-Encoder,for,Open-Set,Recognition"
233,Shapes and Context: In-The-Wild Image Synthesis & Manipulation,"We introduce a data-driven model for interactively synthesizing in-the-wild images from semantic label input masks. Our approach is dramatically different from recent work in this space, in that we make use of no learning. Instead, our approach uses simple but classic tools for matching scene context, shapes, and parts to a stored library of exemplars. Though simple, this approach has several notable advantages over recent work: (1) because nothing is learned, it is not limited to specific training data distributions (such as cityscapes, facades, or faces); (2) it can synthesize arbitrarily high-resolution images, limited only by the resolution of the exemplar library; (3) by appropriately composing shapes and parts, it can generate an exponentially large set of viable candidate output images (that can say, be interactively searched by a user). We present results on the diverse COCO dataset, significantly outperforming learning-based approaches on standard image synthesis metrics. Finally, we explore user-interaction and user-controllability, demonstrating that our system can be used as a platform for user-driven content creation.",http://openaccess.thecvf.com//www.cv-foundation.org/,"Shapes,and,Context:,In-The-Wild,Image,Synthesis,&,Manipulation"
234,Semantics Disentangling for Text-To-Image Generation,"Synthesizing photo-realistic images from text descriptions is a challenging problem. Previous studies have shown remarkable progresses on visual quality of the generated images. In this paper, we consider semantics from the input text descriptions in helping render photo-realistic images. However, diverse linguistic expressions pose challenges in extracting consistent semantics even they depict the same thing. To this end, we propose a novel photo-realistic text-to-image generation model that implicitly disentangles semantics to both fulfill the high-level semantic consistency and low-level semantic diversity. To be specific, we design (1) a Siamese mechanism in the discriminator to learn consistent high-level semantics, and (2) a visual-semantic embedding strategy by semantic-conditioned batch normalization to find diverse low-level semantics. Extensive experiments and ablation studies on CUB and MS-COCO datasets demonstrate the superiority of the proposed method in comparison to state-of-the-art methods.",http://openaccess.thecvf.com//www.cv-foundation.org/,"Semantics,Disentangling,for,Text-To-Image,Generation"
