,0,1,2,3
308,Learning-Based Sampling for Natural Image Matting,"The goal of natural image matting is the estimation of opacities of a user-defined foreground object that is essential in creating realistic composite imagery. Natural matting is a challenging process due to the high number of unknowns in the mathematical modeling of the problem, namely the opacities as well as the foreground and background layer colors, while the original image serves as the single observation. In this paper, we propose the estimation of the layer colors through the use of deep neural networks prior to the opacity estimation. The layer color estimation is a better match for the capabilities of neural networks, and the availability of these colors substantially increase the performance of opacity estimation due to the reduced number of unknowns in the compositing equation. A prominent approach to matting in parallel to ours is called sampling-based matting, which involves gathering color samples from known-opacity regions to predict the layer colors. Our approach outperforms not only the previous hand-crafted sampling algorithms, but also current data-driven methods. We hence classify our method as a hybrid sampling- and learning-based approach to matting, and demonstrate the effectiveness of our approach through detailed ablation studies using alternative network architectures.",http://openaccess.thecvf.com//www.cv-foundation.org/,"Learning-Based,Sampling,for,Natural,Image,Matting"
309,Learning Unsupervised Video Object Segmentation Through Visual Attention,"This paper conducts a systematic study on the role of visual attention in Unsupervised Video Object Segmentation (UVOS) tasks. By elaborately annotating three popular video segmentation datasets (DAVIS, Youtube-Objects and SegTrack V2) with dynamic eye-tracking data in the UVOS setting, for the first time, we quantitatively verified the high consistency of visual attention behavior among human observers, and found strong correlation between human attention and explicit primary object judgements during dynamic, task-driven viewing. Such novel observations provide an in-depth insight into the underlying rationale behind UVOS. Inspired by these findings, we decouple UVOS into two sub-tasks: UVOS-driven Dynamic Visual Attention Prediction (DVAP) in spatiotemporal domain, and Attention-Guided Object Segmentation (AGOS) in spatial domain. Our UVOS solution enjoys three major merits: 1) modular training without using expensive video segmentation annotations, instead, using more affordable dynamic fixation data to train the initial video attention module and using existing fixation-segmentation paired static/image data to train the subsequent segmentation module; 2) comprehensive foreground understanding through multi-source learning; and 3) additional interpretability from the biologically-inspired and assessable attention. Experiments on popular benchmarks show that, even without using expensive video object mask annotations, our model achieves compelling performance in comparison with state-of-the-arts.",http://openaccess.thecvf.com//www.cv-foundation.org/,"Learning,Unsupervised,Video,Object,Segmentation,Through,Visual,Attention"
310,4D Spatio-Temporal ConvNets: Minkowski Convolutional Neural Networks,"In many robotics and VR/AR applications, 3D-videos are readily-available input sources (a sequence of depth images, or LIDAR scans). However, in many cases, the 3D-videos are processed frame-by-frame either through 2D convnets or 3D perception algorithms. In this work, we propose 4-dimensional convolutional neural networks for spatio-temporal perception that can directly process such 3D-videos using high-dimensional convolutions. For this, we adopt sparse tensors and propose generalized sparse convolutions that encompass all discrete convolutions. To implement the generalized sparse convolution, we create an open-source auto-differentiation library for sparse tensors that provides extensive functions for high-dimensional convolutional neural networks. We create 4D spatio-temporal convolutional neural networks using the library and validate them on various 3D semantic segmentation benchmarks and proposed 4D datasets for 3D-video perception. To overcome challenges in 4D space, we propose the hybrid kernel, a special case of the generalized sparse convolution, and trilateral-stationary conditional random fields that enforce spatio-temporal consistency in the 7D space-time-chroma space. Experimentally, we show that a convolutional neural network with only generalized 3D sparse convolutions can outperform 2D or 2D-3D hybrid methods by a large margin. Also, we show that on 3D-videos, 4D spatio-temporal convolutional neural networks are robust to noise and outperform the 3D convolutional neural network.",http://openaccess.thecvf.com//www.cv-foundation.org/,"4D,Spatio-Temporal,ConvNets:,Minkowski,Convolutional,Neural,Networks"
311,Pyramid Feature Attention Network for Saliency Detection,"Saliency detection is one of the basic challenges in computer vision. Recently, CNNs are the most widely used and powerful techniques for saliency detection, in which feature maps from different layers are always integrated without distinction. However, instinctively, the different feature maps of CNNs and the different features in the same maps should play different roles in saliency detection. To address this problem, a novel CNN named pyramid feature attention network (PFAN) is proposed to enhance the high-level context features and the low-level spatial structural features. In the proposed PFAN, a context-aware pyramid feature extraction (CPFE) module is designed for multi-scale high-level feature maps to capture the rich context features. A channel-wise attention (CA) model and a spatial attention (SA) model are respectively applied to the CPFE feature maps and the low-level feature maps, and then fused to detect salient regions. Finally, an edge preservation loss is proposed to get the accurate boundaries of salient regions. The proposed PFAN is extensively evaluated on five benchmark datasets and the experimental results demonstrate that the proposed network outperforms the state-of-the-art approaches under different evaluation metrics.",http://openaccess.thecvf.com//www.cv-foundation.org/,"Pyramid,Feature,Attention,Network,for,Saliency,Detection"
312,Co-Saliency Detection via Mask-Guided Fully Convolutional Networks With Multi-Scale Label Smoothing,"In image co-saliency detection problem, one critical issue is how to model the concurrent pattern of the co-salient parts, which appears both within each image and across all the relevant images. In this paper, we propose a hierarchical image co-saliency detection framework as a coarse to fine strategy to capture this pattern. We first propose a mask-guided fully convolutional network structure to generate the initial co-saliency detection result. The mask is used for background removal and it is learned from the high-level feature response maps of the pre-trained VGG-net output. We next propose a multi-scale label smoothing model to further refine the detection result. The proposed model jointly optimizes the label smoothness of pixels and superpixels. Experiment results on three popular image co-saliency detection benchmark datasets including iCoseg, MSRC and Cosal2015 demonstrate the remarkable performance compared with the state-of-the-art methods.",http://openaccess.thecvf.com//www.cv-foundation.org/,"Co-Saliency,Detection,via,Mask-Guided,Fully,Convolutional,Networks,With,Multi-Scale,Label,Smoothing"
313,SAIL-VOS: Semantic Amodal Instance Level Video Object Segmentation - A Synthetic Dataset and Baselines,"We introduce SAIL-VOS (Semantic Amodal Instance Level Video Object Segmentation), a new dataset aiming to stimulate semantic amodal segmentation research. Humans can effortlessly recognize partially occluded objects and reliably estimate their spatial extent beyond the visible. However, few modern computer vision techniques are capable of reasoning about occluded parts of an object. This is partly due to the fact that very few image datasets and no video dataset exist which permit development of those methods. To address this issue, we present a synthetic dataset extracted from the photo-realistic game GTA-V. Each frame is accompanied with densely annotated, pixel-accurate visible and amodal segmentation masks with semantic labels. More than 1.8M objects are annotated resulting in 100 times more annotations than existing datasets. We demonstrate the challenges of the dataset by quantifying the performance of several baselines. Data and additional material is available at http://sailvos.web.illinois.edu.",http://openaccess.thecvf.com//www.cv-foundation.org/,"SAIL-VOS:,Semantic,Amodal,Instance,Level,Video,Object,Segmentation,-,A,Synthetic,Dataset,and,Baselines"
314,Learning Instance Activation Maps for Weakly Supervised Instance Segmentation,"Discriminative region responses residing inside an object instance can be extracted from networks trained with image-level label supervision. However, learning the full extent of pixel-level instance response in a weakly supervised manner remains unexplored. In this work, we tackle this challenging problem by using a novel instance extent filling approach. We first design a process to selectively collect pseudo supervision from noisy segment proposals obtained with previously published techniques. The pseudo supervision is used to learn a differentiable filling module that predicts a class-agnostic activation map for each instance given the image and an incomplete region response. We refer to the above maps as Instance Activation Maps (IAMs), which provide a fine-grained instance-level representation and allow instance masks to be extracted by lightweight CRF. Extensive experiments on the PASCAL VOC12 dataset show that our approach beats the state-of-the-art weakly supervised instance segmentation methods by a significant margin and increases the inference speed by an order of magnitude. Our method also generalizes well across domains and to unseen object categories. Without fine-tuning for the specific tasks, our model trained on VOC12 dataset (20 classes) obtains top performance for weakly supervised object localization on the CUB dataset (200 classes) and achieves competitive results on three widely used salient object detection benchmarks.",http://openaccess.thecvf.com//www.cv-foundation.org/,"Learning,Instance,Activation,Maps,for,Weakly,Supervised,Instance,Segmentation"
315,Decoders Matter for Semantic Segmentation: Data-Dependent Decoding Enables Flexible Feature Aggregation,"Recent semantic segmentation methods exploit encoder-decoder architectures to produce the desired pixel-wise segmentation prediction. The last layer of the decoders is typically a bilinear upsampling procedure to recover the final pixel-wise prediction. We empirically show that this oversimple and data-independent bilinear upsampling may lead to sub-optimal results. In this work, we propose a data-dependent upsampling (DUpsampling) to replace bilinear, which takes advantages of the redundancy in the label space of semantic segmentation and is able to recover the pixel-wise prediction from low-resolution outputs of CNNs.  The main advantage of the new upsampling layer lies in that with a relatively lower-resolution feature map such as 1/16 or 1/32 of the input size, we can achieve even better segmentation accuracy, significantly reducing computation complexity. This is made possible by 1) the new upsampling layer's much improved reconstruction capability; and more importantly 2) the DUpsampling based decoder's flexibility in leveraging almost arbitrary combinations of the CNN encoders' features. Experiments on PASCAL VOC demonstrate that with much less computation complexity, our decoder outperforms the state-of-the-art decoder. Finally, without any post-processing, the framework equipped with our proposed decoder achieves new state-of-the-art performance on two datasets: 88.1% mIOU on PASCAL VOC with 30% computation of the previously best model; and 52.5% mIOU on PASCAL Context.",http://openaccess.thecvf.com//www.cv-foundation.org/,"Decoders,Matter,for,Semantic,Segmentation:,Data-Dependent,Decoding,Enables,Flexible,Feature,Aggregation"
316,Box-Driven Class-Wise Region Masking and Filling Rate Guided Loss for Weakly Supervised Semantic Segmentation,"Semantic segmentation has achieved huge progress via adopting deep Fully Convolutional Networks (FCN). However, the performance of FCN based models severely rely on the amounts of pixel-level annotations which are expensive and time-consuming. To address this problem, it is a good choice to learn to segment with weak supervision from bounding boxes. How to make full use of the class-level and region-level supervisions from bounding boxes is the critical challenge for the weakly supervised learning task. In this paper, we first introduce a box-driven class-wise masking model (BCM) to remove irrelevant regions of each class. Moreover, based on the pixel-level segment proposal generated from the bounding box supervision, we could calculate the mean filling rates of each class to serve as an important prior cue, then we propose a filling rate guided adaptive loss (FR-Loss) to help the model ignore the wrongly labeled pixels in proposals. Unlike previous methods directly training models with the fixed individual segment proposals, our method can adjust the model learning with global statistical information. Thus it can help reduce the negative impacts from wrongly labeled proposals. We evaluate the proposed method on the challenging PASCAL VOC 2012 benchmark and compare with other methods. Extensive experimental results show that the proposed method is effective and achieves the state-of-the-art results.",http://openaccess.thecvf.com//www.cv-foundation.org/,"Box-Driven,Class-Wise,Region,Masking,and,Filling,Rate,Guided,Loss,for,Weakly,Supervised,Semantic,Segmentation"
317,Dual Attention Network for Scene Segmentation,"In this paper, we address the scene segmentation task by  capturing rich contextual  dependencies based on the self-attention  mechanism. Unlike previous works that capture contexts by multi-scale features fusion, we propose a Dual Attention Networks (DANet) to adaptively integrate local features with their global dependencies. Specifically, we append two types of attention modules on top of traditional dilated FCN, which model the semantic interdependencies in spatial and channel dimensions respectively. The position attention module selectively aggregates the features at each position by a weighted sum of the features at all positions. Similar features would be related to each other regardless of their distances.  Meanwhile, the channel attention module selectively emphasizes interdependent channel maps by integrating associated features among all channel maps. We sum the outputs of the two attention modules to further improve feature representation which contributes to more precise segmentation results. We achieve new state-of-the-art segmentation performance on three challenging scene segmentation datasets, i.e., Cityscapes, PASCAL Context and COCO Stuff dataset. In particular, a Mean IoU score of 81.5% on Cityscapes test set is achieved without using coarse data.",http://openaccess.thecvf.com//www.cv-foundation.org/,"Dual,Attention,Network,for,Scene,Segmentation"
318,InverseRenderNet: Learning Single Image Inverse Rendering,"We show how to train a fully convolutional neural network to perform inverse rendering from a single, uncontrolled image. The network takes an RGB image as input, regresses albedo and normal maps from which we compute lighting coefficients. Our network is trained using large uncontrolled image collections without ground truth. By incorporating a differentiable renderer, our network can learn from self-supervision. Since the problem is ill-posed we introduce additional supervision: 1. We learn a statistical natural illumination prior, 2. Our key insight is to perform offline multiview stereo (MVS) on images containing rich illumination variation. From the MVS pose and depth maps, we can cross project between overlapping views such that Siamese training can be used to ensure consistent estimation of photometric invariants. MVS depth also provides direct coarse supervision for normal map estimation. We believe this is the first attempt to use MVS supervision for learning inverse rendering.",http://openaccess.thecvf.com//www.cv-foundation.org/,"InverseRenderNet:,Learning,Single,Image,Inverse,Rendering"
319,A Variational Auto-Encoder Model for Stochastic Point Processes,"We propose a novel probabilistic generative model for action sequences.  The model is termed the Action Point Process VAE (APP-VAE), a variational auto-encoder that can capture the distribution over the times and categories of action sequences.  Modeling the variety of possible action sequences is a challenge, which we show can be addressed via the APP-VAE's use of latent representations and non-linear functions to parameterize distributions over which event is likely to occur next in a sequence and at what time.  We empirically validate the efficacy of APP-VAE for modeling action sequences on the MultiTHUMOS and Breakfast datasets.",http://openaccess.thecvf.com//www.cv-foundation.org/,"A,Variational,Auto-Encoder,Model,for,Stochastic,Point,Processes"
320,Unifying Heterogeneous Classifiers With Distillation,"In this paper, we study the problem of unifying knowledge from a set of classifiers with different architectures and target classes into a single classifier, given only a generic set of unlabelled data. We call this problem Unifying Heterogeneous Classifiers (UHC). This problem is motivated by scenarios where data is collected from multiple sources, but the sources cannot share their data, e.g., due to privacy concerns, and only privately trained models can be shared. In addition, each source may not be able to gather data to train all classes due to data availability at each source, and may not be able to train the same classification model due to different computational resources. To tackle this problem, we propose a generalisation of knowledge distillation to merge HCs. We derive a probabilistic relation between the outputs of HCs and the probability over all classes. Based on this relation, we propose two classes of methods based on cross-entropy minimisation and matrix factorisation, which allow us to estimate soft labels over all classes from unlabelled samples and use them in lieu of ground truth labels to train a unified classifier. Our extensive experiments on ImageNet, LSUN, and Places365 datasets show that our approaches significantly outperform a naive extension of distillation and can achieve almost the same accuracy as classifiers that are trained in a centralised, supervised manner.",http://openaccess.thecvf.com//www.cv-foundation.org/,"Unifying,Heterogeneous,Classifiers,With,Distillation"
321,Assessment of Faster R-CNN in Man-Machine Collaborative Search,"With the advent of modern expert systems driven by deep learning that supplement human experts  (e.g. radiologists, dermatologists, surveillance scanners), we analyze how and when do such expert systems enhance human performance in a fine-grained small target visual search task.  We set up a 2 session factorial experimental design in which humans visually search for a target  with and without a Deep Learning (DL) expert system. We evaluate human changes of target detection performance and eye-movements in the presence of the DL system. We find that performance improvements with the DL system (computed via a Faster R-CNN with a VGG16) interacts with observer's perceptual abilities (e.g., sensitivity). The main results include: 1) The DL system reduces the False Alarm rate per Image on average across observer groups of both high/low sensitivity; 2) Only human observers with high sensitivity perform better than the DL system, while the low sensitivity group does not surpass individual DL system performance, even when aided with the DL system itself; 3) Increases in number of trials and decrease in viewing time were mainly driven by the DL system only for the low sensitivity group. 4) The DL system aids the human observer to fixate at a target by the 3rd fixation.  These results provide insights of the benefits and limitations of deep learning systems that are collaborative or competitive with humans.",http://openaccess.thecvf.com//www.cv-foundation.org/,"Assessment,of,Faster,R-CNN,in,Man-Machine,Collaborative,Search"
322,OK-VQA: A Visual Question Answering Benchmark Requiring External Knowledge,"Visual Question Answering (VQA) in its ideal form lets us study reasoning in the joint space of vision and language and serves as a proxy for the AI task of scene understanding. However, most VQA benchmarks to date are focused on questions such as simple counting, visual attributes, and object detection that do not require reasoning or knowledge beyond what is in the image. In this paper, we address the task of knowledge-based visual question answering and provide a benchmark, called OK-VQA, where the image content is not sufficient to answer the questions, encouraging methods that rely on external knowledge resources. Our new dataset includes more than 14,000 questions that require external knowledge to answer. We show that the performance of the state-of-the-art VQA models degrades drastically in this new setting. Our analysis shows that our knowledge-based VQA task is diverse, difficult, and large compared to previous knowledge-based VQA datasets. We hope that this dataset enables researchers to open up new avenues for research in this domain.",http://openaccess.thecvf.com//www.cv-foundation.org/,"OK-VQA:,A,Visual,Question,Answering,Benchmark,Requiring,External,Knowledge"
323,NDDR-CNN: Layerwise Feature Fusing in Multi-Task CNNs by Neural Discriminative Dimensionality Reduction,"In this paper, we propose a novel Convolutional Neural Network (CNN) structure for general-purpose multi-task learning (MTL), which enables automatic feature fusing at every layer from different tasks. This is in contrast with the most widely used MTL CNN structures which empirically or heuristically share features on some specific layers (e.g., share all the features except the last convolutional layer). The proposed layerwise feature fusing scheme is formulated by combining existing CNN components in a novel way, with clear mathematical interpretability as discriminative dimensionality reduction, which is referred to as Neural Discriminative Dimensionality Reduction (NDDR). Specifically, we first concatenate features with the same spatial resolution from different tasks according to their channel dimension. Then, we show that the discriminative dimensionality reduction can be fulfilled by 1x1 Convolution, Batch Normalization, and Weight Decay in one CNN. The use of existing CNN components ensures the end-to-end training and the extensibility of the proposed NDDR layer to various state-of-the-art CNN architectures in a ""plug-and-play"" manner. The detailed ablation analysis shows that the proposed NDDR layer is easy to train and also robust to different hyperparameters. Experiments on different task sets with various base network architectures demonstrate the promising performance and desirable generalizability of our proposed method. The code of our paper is available at https://github.com/ethanygao/NDDR-CNN.",http://openaccess.thecvf.com//www.cv-foundation.org/,"NDDR-CNN:,Layerwise,Feature,Fusing,in,Multi-Task,CNNs,by,Neural,Discriminative,Dimensionality,Reduction"
324,Spectral Metric for Dataset Complexity Assessment,"In this paper, we propose a new measure to gauge the complexity of image classification problems.  Given an annotated image dataset, our method computes a complexity measure called the cumulative spectral gradient (CSG) which strongly correlates with the test accuracy of convolutional neural networks (CNN). The CSG measure is derived from the probabilistic divergence between classes in a spectral clustering framework. We show that this metric correlates with the overall separability of the dataset and thus its inherent complexity. As will be shown, our metric can be used for dataset reduction, to assess which classes are more difficult to disentangle, and approximate the accuracy one could expect to get with a CNN.  Results obtained on 11 datasets and three CNN models reveal that our method is more accurate and faster than previous complexity measures.",http://openaccess.thecvf.com//www.cv-foundation.org/,"Spectral,Metric,for,Dataset,Complexity,Assessment"
